63,8/25/11,MO,2,2,3,1,-7,4,21,25,2,Missouri Rehabilitation Services for the Blind,Family Support Division,Deputy Director,Division Director,-9,-7,-7,Division Director,2,-7,-7,3,3,3,3,3,3,3,3,3,2,3,-9,-7,3,3,1,1,99,99,1,99,1,2,-7,111.07,-9,-7,-7,-9,-7,-7,-9,-7,-7,-9,-7,-7,-9,-7,-7,-9,-7,-7,-9,-7,-7,-9,-9,-7,-9,-7,-7,-7,0,100,2,0,0,0,0,0,19,0,0,6,0,0,0,0,-9,-7,2,1,1,1,1,1,1,2,-7,2,2,2,1,1,2,-7,1,-7,1,1,1,1,1,-7,1,-7,-9,-9,-9,-9,-9,-9,-7,-7,-7,-9,-9,-9,-9,-9,-9,-7,-7,1,-7,2,-7,1,1,-7,1,-7,2,-7,-7,1,2,1,1,1,1,-7,0,0,1,0,1,0,0,0,0,0,0,1,0,Department of Health and Senior Services,0,0,0,0,0,0,0,0,0,0,0,0,1,-7,-9,-9,-9,-9,-9,-9,-9,-9,-9,-9,-9,-9,-9,-7,-9,-9,-9,-9,-9,-9,-9,-9,-9,-9,-9,-9,-9,-7,0,0,0,0,0,0,0,0,0,0,0,0,1,-7,-9,-9,-9,-9,-9,-9,-9,-9,-9,-9,-9,-9,-9,-7,0,0,0,0,0,0,0,0,0,0,0,0,1,-7,0,0,0,0,0,0,0,0,0,0,0,0,1,-7,-9,-9,-9,-9,-9,-9,-9,-9,-9,-9,-9,-9,-9,-7,0,0,0,0,0,0,0,0,0,0,0,0,1,-7,-9,-9,-7,-9,-7,-9,-7,-9,-7,-7,-7,2,-7,1,$7.25 per hour,2,-7,1,-9,1,-7,-9,-7,-9,-7,2,-7,-9,-7,3,-7,2,-7,2,-7,-7,-7,-7,-7,1,0,1,0,0,0,0,0,0,-7,-9,-9,-9,-9,-9,-9,-9,-7,-9,-7,-7,-7,-9,-7,-7,-7,-9,-7,-7, ,-9,-9,-7,-7,-9,-7,-7,-7,-9,-7,-7,-7,-9,-7,-7,-7,-9, ,-7,-7,-7,-9,0,0,0,0,0,0,1,-7,-9,-7,-986,2/10/11,MP,3,1,4,1,-7,5.2,5.2,5.2,1,Northern Marianas Office of Vocational Rehabilitation,-7,Director,-7,1,GOVERNOR,-7,Governor,2,-7,-7,3,3,3,3,3,3,3,3,3,3,3,-9,-7,3,3,1,1,3,3,99,99,1,2,-7,-9,-9,-7,-7,-9,-7,-7,-9,-7,-7,-9,-7,-7,-9,-7,-7,-9,12,-7,-9,-7,-7,-9,-9,-7,-9,-7,-7,-7,5,0.5,-9,0.5,-9,-9,-9,-9,4,-9,-9,-9,-9,1,-9,-9,-9,-7,1,1,1,1,1,1,1,1,-7,1,1,1,1,1,1,-7,1,-7,1,1,1,-9,1,-7,1,-7,0,0,0,0,0,1,-7,-7,-7,0,0,0,0,0,1,-7,-7,1,-7,1,It is within the VR State Plan inclusive of the requirements that the DSU must follow in partnership with SRC.,1,1,-7,1,-7,2,-7,-7,1,1,1,1,1,1,-7,0,1,1,1,1,1,1,1,1,1,1,1,0,CRP,0,0,0,0,1,1,1,1,1,1,1,1,0,Parent Center/Ayuda Network,0,0,0,0,0,0,0,0,0,0,0,0,1,-7,0,0,0,0,0,0,0,0,0,0,0,0,1,-7,0,0,0,0,0,0,0,0,0,0,0,0,1,-7,0,0,0,0,0,0,0,0,0,0,0,0,1,-7,0,0,1,1,1,1,1,1,0,0,0,0,0,-7,0,0,0,0,0,0,0,0,0,0,0,0,1,-7,0,0,0,0,0,0,0,0,0,0,0,0,1,-7,0,0,0,0,0,0,0,0,0,0,0,0,1,-7,-9,-9,-7,-9,-7,-9,-7,-9,-7,-7,-7,2,-7,1,$5.05 ,-9,-7,-9,-7,-9,-7,-9,-7,-9,-7,-9,-7,-9,-7,-9,-7,-9,-7,1,-9,Title I and Title IV,-9,-9,-9,0,1,1,1,1,0,1,0,0,-7,1,1,1,0,0,1,0,Sole Source contracts,2,-7,-7,-7,2,-7,-7,-7,2,-7,-7, ,2,-9,-7,-7,2,-7,-7,-7,2,-7,-7,-7,2,-7,-7,-7,2, ,-7,-7,-7,1,1,0,0,0,0,1,0,Northern Marianas College,-9,-7,no73,9/19/11,MS,3,1,4,1,-7,3.5,18,18,1,Mississippi Department of Rehabilitation Services,-7,Executive Director,-7,1,by Board of directors,-7,Board Chair,2,-7,-7,1,3,3,3,3,3,3,3,3,3,3,1,-9,1,3,1,1,99,99,1,3,1,1,Choctaw nation,1230,15,7,8,445,-9,445,124,-9,-9,20,20,-9,9,-9,-9,673.5,674,-9,-9,-7,-7,9,-9,-9,-9,-7,-7,-7,6,85,10,16,0,0,0,0,-9,0,15,3,26,34,0,0,-9,-7,3,3,1,1,1,1,1,1,-7,1,1,1,3,1,1,-7,1,-7,1,1,1,1,1,-7,1,-7,0,1,0,0,0,0,-7,-7,-7,0,0,1,0,1,0,-7,Interstate vending,1,-7,1,Annual Program planning process,2,1,-7,1,-7,2,-7,-7,1,1,1,1,1,1,-7,0,0,1,1,1,1,1,1,0,1,1,0,0,-7,0,0,0,0,0,0,0,1,0,0,0,0,0,-7,0,0,0,0,0,0,1,0,0,0,0,0,0,-7,0,0,1,0,0,0,1,0,0,0,1,0,0,-7,0,0,1,0,0,0,0,0,0,0,1,0,0,-7,0,0,1,1,1,1,1,1,0,1,1,0,0,-7,0,0,0,0,0,0,1,0,0,0,1,0,0,-7,0,0,0,0,0,0,0,0,0,0,0,0,1,-7,0,0,0,0,0,0,0,0,0,0,0,0,1,-7,0,0,0,0,0,0,0,0,0,0,0,1,0,medicaid and medicare,97,2,-7,2,-7,2,-7,2,-7,-7,-7,2,-7,1,minimum  wage,2,-7,3,-7,3,-7,2,-7,2,-7,2,-7,2,-7,3,-7,2,-7,2,-7,-7,-7,-7,-7,1,1,0,1,0,0,0,1,0,employers and churches,1,0,0,0,0,0,0,-7,2,-7,-7,-7,2,-7,-7,-7,2,-7,-7, ,2,-9,-7,-7,2,-7,-7,-7,1,1,2,-7,2,-7,-7,-7,2, ,-7,-7,-7,2,0,0,0,0,0,1,0,The ARC,1,most SE extended follow- up services are done free of charge,-9105,3/24/11,MT,3,1,3,2,Program Support Bureau Chief,25,27,27,1,Division of Disability Services,-7,Disability Employment Independence and Transitions Director,-7,2,-7,-7,Economic Security Branch Manager,2,-7,-7,1,3,3,3,3,3,3,3,3,3,3,3,-9,-9,3,1,1,99,99,1,99,1,1,There are 6 Section 121 Projects in Montana,-9,-9,-7,-7,50,-9,50,1.5,-9,1.5,-9,-7,-7,-9,-7,-7,94.5,94.5,-9,-9,-7,-7,-9,-9,-7,2,-9,2,Transportation/MIG,0,18,0,1,0,0,0,0,0,0,0,4,1,0,0,0,-9,-7,3,1,1,1,1,1,1,1,-7,3,1,1,3,1,1,-7,95,-9,1,1,1,1,1,-7,1,-7,0,0,1,0,0,0,In Service,-7,-7,0,0,0,0,0,1,-7,-7,1,-7,1,Input collected from a variety of sources; management staff and SRC representatives craft the plan,1,1,-7,1,-7,2,-7,-7,1,1,1,1,1,1,-7,0,0,1,0,0,1,1,1,0,0,0,1,0,Higher Ed; NA Sec 121 Projects,0,0,0,0,0,1,0,1,0,0,0,1,0,Extended Employment,0,0,0,0,0,1,1,0,0,1,0,0,0,-7,0,0,0,0,0,0,0,0,0,0,0,0,1,-7,0,0,0,0,0,0,0,0,0,0,0,0,1,-7,0,0,0,0,0,0,0,0,1,0,0,1,0,NA Sec 121,0,0,0,0,0,0,0,0,0,0,0,0,1,-7,0,0,0,0,0,0,0,0,0,0,0,0,1,-7,0,0,0,0,0,1,0,1,0,0,0,0,0,-7,0,0,0,0,0,0,0,0,0,0,0,0,1,-7,62,2,-7,2,-7,2,-7,2,-7,-7,-7,2,-7,2,-7,2,-7,3,-7,3,-7,3,-7,3,-7,2,-7,3,-7,-9,-7,-9,-7,1,Rocky Mountain Rehab,State funds,-9,-9,most significantly disabled,1,1,1,0,1,0,0,0,0,-7,1,1,0,0,0,0,0,-7,1,1,2,-7,1,1,2,-7,1,1,2, ,1,1,2,-7,-9,-7,-7,-7,1,1,2,-7,2,-7,-7,-7,1,VR's extended employment funds (100% state funds),1,1,1,2,0,1,0,1,0,0,0,-7,2,-7,-976,4/1/11,NC,1,1,3,1,-7,5,5,5,2,North Carolina Division of Vocational Rehabilitation,Department of Health and Human Services,Director,Secretary,1,secretary,-7,deputy secretary,2,-7,-7,1,3,2,2,2,3,3,2,2,2,3,-9,-7,1,1,2,1,3,3,2,99,1,1,lumbee and cherokee tribes,1822,21,-9,-9,761,-9,-9,106,-9,-9,7,-9,-9,-9,-7,-7,530,-9,-9,-9,-7,-7,7,-9,-9,-9,-7,-7,-7,7,0,68,10,3,0,27,-9,109,0,9,0,117,41,1,0,0,-9,1,1,1,1,1,1,1,1,-7,3,3,3,3,1,95,state purchasing and contracts,95,ITS,1,1,1,1,1,-7,1,-7,1,1,0,0,0,0,-7,-7,-7,0,0,0,0,0,1,-7,-7,1,-7,1,utilize statewide needs assessment and planning,1,1,-7,1,-7,2,-7,-7,1,1,1,1,1,1,-7,0,0,1,1,1,0,0,0,0,0,1,1,0,we have MOU agreements with IDD and MH,0,0,0,0,0,0,0,0,0,0,0,0,1,-7,0,0,0,1,1,0,0,0,0,0,1,0,0,-7,0,0,0,0,1,0,0,0,0,0,1,0,0,-7,0,0,0,0,1,0,0,0,0,0,1,0,0,-7,0,0,0,0,0,0,0,0,0,0,1,0,0,-7,0,0,0,0,1,0,0,0,0,0,1,0,0,-7,0,0,0,0,0,0,0,0,0,0,0,0,1,-7,0,0,0,0,0,0,0,0,0,0,0,0,1,-7,0,0,0,0,0,0,0,0,0,0,0,0,1,-7,916,2,-7,2,-7,2,-7,1,Mental health counseling - MH case management,2,-7,2,-7,1,state minimum wage $7.25 / hour,3,-7,1,916,-9,-7,1,9,2,-7,2,-7,2,-7,1,180,2,-7,1,MH handles this,state appropriations,-9,-9,mh/idd,1,1,1,0,1,0,0,0,0,-7,1,0,0,0,0,0,0,-7,2,-7,-7,-7,2,-7,-7,-7,2,-7,-7, ,2,-9,-7,-7,2,-7,-7,-7,2,-7,-7,-7,2,-7,-7,-7,2, ,-7,-7,-7,1,0,1,0,0,1,0,0,-7,-9,-7,-971,2/14/11,NC,2,2,3,1,-7,8,27,27,2,North Carolina Division of Services for the Blind,Department of Health and Human Services,Eddie Weaver,Secretary,1,Governor,-7,Deputy Secretary of Health and Human Services,2,-7,-7,2,3,2,2,2,3,3,2,2,2,3,-9,-7,2,2,1,2,3,99,1,99,1,1,Lumbee and Cherokee Tribes,176,0.9,0.9,-7,-9,-7,-7,-9,-7,-7,-9,-7,-7,14,14,-9,0.48,0.48,-7,-9,-7,-7,-9,-9,-7,-9,-7,-7,-7,0,0.48,0.7,0.5,0,0,0,0,0,0,0,0.11,0.1,0.1,0,0,-9,-7,1,1,1,1,1,1,1,1,-7,1,3,1,2,1,1,-7,2,-7,1,1,1,1,1,-7,1,-7,0,0,0,0,0,1,-7,-7,-7,0,0,0,0,0,1,-7,-7,1,-7,2,-7,2,1,-7,1,-7,1,-9,2,1,1,1,1,1,1,-7,0,0,1,1,0,0,0,0,0,0,0,0,0,-7,0,0,0,0,0,0,0,0,0,0,0,0,1,-7,0,0,1,0,0,0,0,0,0,0,0,0,0,-7,0,0,1,0,0,0,0,0,0,0,0,0,0,-7,0,0,0,0,0,0,0,0,0,0,0,0,1,-7,0,0,0,0,0,0,0,0,0,0,0,0,1,-7,0,0,0,0,0,0,0,0,0,0,0,0,1,-7,0,0,0,0,0,0,0,0,0,0,0,0,1,-7,0,0,0,0,0,0,0,0,0,0,0,0,1,-7,0,0,0,0,0,0,0,0,0,0,0,0,1,-7,10,2,-7,1,100,2,-7,2,-7,-7,-7,1,10,1,minimum wage,2,-7,1,10,2,-7,2,-7,2,-7,2,-7,2,-7,3,-7,2,-7,2,-7,-7,-7,-7,-7,0,1,0,0,0,0,0,0,0,-7,0,1,0,0,0,0,0,-7,2,-7,-7,-7,2,-7,-7,-7,2,-7,-7, ,2,-9,-7,-7,2,-7,-7,-7,2,-7,-7,-7,2,-7,-7,-7,2, ,-7,-7,-7,2,0,0,0,0,0,0,1,-7,2,-7,-936,2/14/11,ND,3,1,3,2,Planning and Evaluation Administrator,1,14,14,2,North Dakota Division of Vocational Rehabilitation,North Dakota Department of Human Services,VR Director,DHS Executive Director,2,-7,-7,DHS Cabinet Member,2,-7,-7,1,3,2,2,2,3,3,2,2,2,3,-9,-7,2,1,1,1,99,3,1,3,1,1,"Donna Thomas, Turtle Mountain Band of Chippewa Indians, Jon Eagle Standing Rock Sioux Vocational Reh",105,-9,-7,-7,24,-9,24,0.25,0.25,-7,1,1,-7,0.25,0.25,-7,79.5,79.5,-9,-9,-7,-7,-9,-7,-7,-9,-7,-7,-7,0,8,5,0,0,0,0,0,4,2,1,3,9,3.5,0,0,-9,-7,3,1,1,1,1,1,1,1,-7,2,2,1,1,1,2,-7,1,-7,1,1,1,1,1,-7,1,-7,0,0,0,0,0,1,-7,-7,-7,0,0,0,1,0,0,Social Security Reimbursement,-7,1,-7,1,five year stategic plan and managment plan for implementation with SRC,1,1,-7,1,-7,2,-7,-7,1,1,1,1,1,1,-7,1,0,1,1,1,1,1,1,1,1,0,0,0,-7,0,0,0,0,0,1,0,1,0,0,0,1,0,State Funded extended service program,0,0,0,0,0,1,0,1,0,0,1,1,0,"Substance Abuse Counseling, Transition,",0,0,0,0,1,1,1,1,0,0,1,0,0,-7,0,0,0,0,0,0,0,0,0,0,1,0,0,-7,0,0,0,1,1,1,1,1,0,1,1,0,0,-7,0,0,1,1,1,1,1,1,0,1,1,0,0,-7,0,0,0,0,0,1,0,1,0,0,0,0,0,-7,0,0,0,0,0,1,0,1,0,0,0,0,0,-7,0,0,0,0,0,1,0,1,0,0,0,0,0,-7,59,2,-7,2,-7,2,-7,1,State funded extended service,2,-7,2,-7,2,-7,2,-7,3,-7,3,-7,3,-7,3,-7,2,-7,2,-7,3,-7,2,-7,1,State Extended Service,State General Fund,140000,50,"TBI, Mental Health, DD/non waiver, LD, Autism Spectrum Disorder, Blind",0,1,1,0,0,0,1,0,0,-7,1,0,0,0,0,0,0,-7,2,1,-7,-7,2,-7,-7,-7,2,-7,-7, ,2,1,-7,-7,2,-7,-7,-7,2,-7,-7,-7,2,-7,-7,-7,1,State General Fund,1,1,50,2,0,0,0,1,1,0,0,-7,2,-7,-966,9/19/11,NE,1,1,2,1,-7,1,2,2,1,Nebraska Division of Rehabilitation Services,-7,"Assistant Commissioner, Director of  Rehabilitation Services",-7,1,Commissioner of Department of Education,-7,Deputy Commissioner of Education,2,-7,-7,1,3,3,3,3,3,3,3,3,3,3,3,-9,1,1,3,1,3,3,3,3,1,2,-7,193,28,5,23,78,-9,78,-9,-7,-7,-9,-7,-7,-9,-7,-7,193,192,1,-9,-7,-7,-9,-9,-7,-9,-7,-7,-7,0,0,13,2,5,0,0,0,34,0,0,0,13,11,0,0,0,-9,1,1,1,1,1,1,1,1,-7,1,1,1,1,1,1,-7,1,-7,1,1,1,1,1,-7,1,-7,0,0,1,0,0,0,HRSA TBI Implementation Grant,-7,-7,0,0,0,0,0,1,-7,-7,1,-7,2,-7,2,1,-7,1,-7,2,-7,-7,1,1,1,1,1,1,-7,1,0,1,1,1,0,1,1,0,0,1,0,0,-7,0,0,0,0,0,0,0,1,0,0,0,0,0, ,0,0,0,0,0,0,0,0,0,0,0,0,1,-7,1,0,0,0,1,0,0,1,0,0,1,0,0,-7,1,0,0,0,1,0,0,0,0,0,0,0,0,-7,0,0,0,0,0,0,0,1,0,0,0,0,0,-7,0,0,0,0,0,0,0,0,0,0,0,0,1,-7,0,0,0,0,0,0,0,0,0,0,0,0,1,-7,0,0,0,0,0,0,0,0,0,0,0,0,1,-7,0,0,0,0,0,0,0,0,0,0,0,0,1,-7,177,2,-7,2,-7,2,-7,1,long term supports,2,-7,2,-7,2,-7,2,-7,1,177,1,0,2,-7,2,-7,2,-7,2,-7,3,-7,2,-7,2,-7,-7,-7,-7,-7,1,1,1,1,0,0,0,0,0,-7,1,0,0,0,0,0,0,-7,2,-7,-7,-7,2,-7,-7,-7,2,-7,-7, ,2,-9,-7,-7,2,-7,-7,-7,1,1,1,0,1,1,2,-7,2, ,-7,-7,-7,3,0,0,0,0,1,0,0,-7,1,Brain Injury,-929,3/24/11,NH,3,1,2,1,-7,1,9,11,2,New Hampshire Vocational Rehabilitation,Department of Education,Director,Commissioner,1,Governor,-7,Deputy Commissioner,2,-7,-7,2,2,3,3,3,2,3,3,3,3,3,3,-9,3,3,1,1,1,3,1,3,1,2,-7,89,-9,-7,-7,50,-9,50,0.2,-7,0.2,-9,-7,-7,-9,-7,-7,89,89,-9,-9,-7,-7,-9,-7,-7,-9,-7,-7,-7,2.5,8,3,5,5,25,25,35,7,0,0,0,3,2,0,0,-9,-7,2,3,2,2,1,1,1,2,-7,2,2,2,2,1,2,-7,2,-7,1,1,1,1,1,-7,1,-7,0,0,1,0,0,0,"ARRA, OIB",-7,-7,0,0,0,1,0,0,"Program Income- SSA, Maximus",-7,1,-7,1,Updating every quarter,1,1,-7,1,-7,2,-7,-7,1,1,1,1,1,1,-7,1,0,0,1,1,1,1,1,1,1,1,0,0,-7,0,0,0,0,1,1,0,1,0,0,0,0,0,-7,0,0,0,0,1,0,0,0,0,0,0,0,0,-7,0,0,0,0,0,1,0,1,0,0,0,0,0,-7,0,0,0,0,0,0,0,0,0,0,0,0,1,-7,1,0,0,0,1,1,0,1,1,0,0,0,0,-7,0,0,0,0,0,0,0,0,0,0,0,0,1,-7,0,0,0,0,0,0,0,0,0,0,0,0,1,-7,0,0,0,0,0,0,0,0,0,0,0,0,1,-7,0,0,0,0,0,0,0,0,0,0,0,0,1,-7,47,1,45,-9,-7,1,2,2,-7,-7,-7,2,-7,2,-7,1,47,1,0,1,7,2,-7,2,-7,2,-7,1,0,1,47,2,-7,2,-7,-7,-7,-7,-7,1,1,1,0,0,0,1,0,0,-7,0,0,1,0,1,0,0,-7,1,1,1,2,2,-7,-7,-7,1,1,1,5,1,1,1,42,2,-7,-7,-7,2,-7,-7,-7,2,-7,-7,-7,2, ,-7,-7,-7,3,0,0,0,0,1,0,0,-7,2,-7,-982,2/9/11,NJ,1,1,1,1,-7,1,1,1,2,New Jersey Division of Vocational Rehabilitation Services,Department of Labor and Workforce Development,State Director,Commissioner of Labor,3,-7,-7,Assistant Commissioner Workforce Development,2,-7,-7,3,3,3,3,3,3,2,3,3,2,2,-9,-7,1,3,3,1,2,1,3,3,1,2,-7,321.4,0.1,0.1,-7,-9,-7,-7,5,0.5,-9,-9,-7,-7,-9,-7,-7,287.4,287.4,-9,-9,-7,-7,-9,-7,-7,30.7,30.7,-9,Asst Commissioner; DIT; Dept AS &T,1,0,0.5,15,0,0,2,0.5,9,0,0.5,0,14,0,0,1,0,-9,2,3,2,2,1,3,1,2,-7,2,2,2,1,2,2,-7,2,-7,1,1,1,1,1,-7,1,-7,0,0,1,0,0,0,DEI; AT,-7,-7,0,0,1,1,1,0,Social security,Private donation,1,-7,1,State plan with input from SRC,1,1,-7,1,-7,2,-7,-7,2,2,2,2,2,2,-7,0,0,0,1,1,1,1,1,0,0,0,0,0,-7,0,0,0,0,0,1,0,1,0,0,0,0,0,-7,0,0,0,1,0,0,1,0,1,1,0,0,0,-7,0,0,0,1,0,0,1,1,0,0,0,0,0,-7,0,0,0,1,0,0,0,0,0,0,0,0,0,-7,0,0,0,1,0,1,1,0,0,1,0,0,0,-7,0,0,0,0,0,0,1,0,0,0,0,1,0,DHS,0,0,0,0,0,0,1,0,0,0,0,0,0,-7,0,0,0,0,0,1,0,0,0,0,0,0,0,-7,0,0,0,0,0,0,0,0,0,0,0,0,1,-7,3116,1,28,2,-7,1,100,2,-7,-7,-7,2,-7,2,-7,3,-7,3,-7,2,-7,3,-7,2,-7,2,-7,3,-7,1,256,2,-7,1,LTFA,State grants & Aid,4550000,3100,"DD,DMH,TBI, DEAF",0,1,1,0,0,0,0,1,0,DMH,1,0,0,0,0,0,0,-7,2,-7,-7,-7,2,-7,-7,-7,2,-7,-7, ,2,-9,-7,-7,2,-7,-7,-7,1,2,2,-7,2,-7,-7,-7,2, ,-7,-7,-7,2,0,0,0,1,1,0,0,-7,2,-7,This survey is onerous and time consuming112,3/2/11,NJ,2,2,3,2,"Chief, Field Operations",8,24,24,2,New Jersey Commission for the Blind and Visually Impaired,Department of Human Services,Director,Commissioner,1,"Commissioner, Human Services",-7,"Commissioner, Human Services",2,-7,-7,3,3,2,2,2,3,3,3,2,2,3,-9,-7,1,3,1,1,3,3,1,3,1,2,-7,287,-9,-7,-7,-9,-7,-7,-9,-7,-7,-9,-7,-7,8,-9,-9,100, ,-9,-9,-7,-7,-9,-9,-7,-9,-7,-7,-7,0,36,8,2,0,0,0,0,30,0,0,4,6,0,0,0,-9,-7,1,1,1,1,1,1,1,1,-7,1,1,1,1,1,1,-7,1,-7,1,1,1,1,1,-7,1,-7,0,0,0,0,0,1,-7,-7,-7,0,0,1,0,1,0,-7,Donations,1,-7,2,-7,1,1,-7,1,-7,2,-7,-7,1,1,1,1,1,1,-7,0,0,1,0,1,0,0,0,0,0,0,0,0,-7,0,0,1,0,1,0,1,0,0,0,0,0,0,-7,0,0,0,0,0,0,0,0,0,0,0,0,1,-7,0,0,0,0,0,0,0,0,0,0,0,0,1,-7,0,0,0,0,0,0,0,0,0,0,0,0,1,-7,0,0,1,0,0,0,0,0,0,0,0,0,0,-7,0,0,0,0,0,0,0,0,0,0,0,0,1,-7,0,0,0,0,0,0,0,0,0,0,0,0,1,-7,0,0,0,0,0,0,0,0,0,0,0,0,1,-7,0,0,0,0,0,0,0,0,0,0,0,0,1,-7,15,2,-7,2,-7,2,-7,2,-7,-7,-7,2,-7,1,minimum wage,3,-7,2,-7,2,-7,2,-7,3,-7,2,-7,2,-7,3,-7,2,-7,2,-7,-7,-7,-7,-7,1,1,0,0,0,0,0,0,0,-7,1,0,1,0,0,0,0,-7,2,-7,-7,-7,2,-7,-7,-7,2,-7,-7, ,2,-9,-7,-7,2,-7,-7,-7,2,-7,-7,-7,2,-7,-7,-7,2, ,-7,-7,-7,2,0,0,0,1,0,0,0,-7,2,-7,-9127,3/14/11,NM,1,1,2,1,-7,2.5,22,22,2,New Mexico Division of Vocational Rehabilitation,Public Education Department,Director for Vocational Rehabilitation,Secretary of Education,1,Secretary of Education and Governor,-7,Secretary of Education,2,-7,-7,1,2,3,3,3,2,3,3,3,3,3,3,Developmental Disabilities Planning Council,1,3,3,1,1,3,3,99,1,1,"Navajo OSERS, Pueblo of Jemez, Pueblo of Zuni, Pueblos of Laguna/Acoma",289,2.75,-9,2.75,94,-9,94,1,1,-7,1,1,-7,-9,-7,-7,196,169,-9,-9,-7,-7,5,-9,5,1,-7,1,Migrant Program,5,0,0,3,0,0,0,3,33,1,0,0,4,0,0,0,1,Traumatic Brain Injury,1,1,1,1,1,1,1,1,-7,1,1,1,1,1,1,-7,1,-7,1,1,1,1,1,-7,1,-7,1,1,1,0,0,0,"Migrant, One Stop Navigators",-7,-7,0,0,0,1,0,0,Social Security Reimbursements,-7,1,-7,1,"Create a Strategic Planning Framework every five years.  Revise strategic plan, which relates to framework annually.  Includes project activities",1,1,-7,1,-7,2,-7,-7,1,1,1,1,1,1,-7,0,0,1,1,0,1,0,1,1,0,1,1,0,Native American 121 programs,0,0,0,0,0,1,0,1,0,0,0,0,0,-7,0,0,0,0,0,0,0,0,0,1,0,0,0,-7,0,0,0,0,0,1,0,1,0,0,0,0,0,-7,0,0,0,0,0,0,0,0,0,0,0,0,1,-7,0,0,0,0,0,1,0,1,0,0,0,1,0,Native American 121 programs,0,0,0,0,0,1,0,0,0,0,0,1,0,Commission for the Deaf/Hard of Hearing,0,0,0,0,0,0,0,0,0,0,0,0,1,-7,0,0,0,0,0,0,0,0,0,0,0,0,1,-7,0,0,0,0,0,1,0,0,0,0,0,0,0,-7,40,1,1,1,90,1,3,2,-7,-7,-7,2,-7,2,-7,2,-7,3,-7,3,-7,2,-7,2,-7,3,-7,3,-7,3,-7,2,-7,2,-7,-7,-7,-7,-7,1,1,1,0,1,1,0,0,0,-7,1,0,1,0,0,0,0,-7,1,1,1,40,1,1,1,2,2,-7,-7, ,2,-9,-7,-7,2,-7,-7,-7,1,1,1,0,2,-7,-7,-7,2, ,-7,-7,-7,2,0,1,0,1,1,0,0,-7,1,Traumatic Brain Injury,-9140,3/15/11,NM,2,2,4,2,Deputy Director for Vocational Rehabilitation,8,12,12,1,New Mexico Commission for the Blind,-7,Executive Director,-7,1,Commission Board of Directors,-7,Commission Board of Directors,2,-7,-7,3,3,3,3,3,3,3,3,3,3,3,-9,-7,3,3,1,1,99,99,1,99,1,1,"4 grants: Navahoe, Zuni, Laguna-Acoma, Jemez-Zia-St Anna",95,-9,-7,-7,-9,-7,-7,11,-9,-9,-9,-7,-7,3,-9,-9,45,-9,-9,-9,-7,-7,-9,-9,-7,-9,-7,-7,-7,0,41,0,0,0,0,0,0,0,0,0,3,1,0,0,0,-9,-7,1,1,1,1,1,1,1,1,-7,1,1,1,1,1,1,-7,1,-7,1,1,1,1,1,-7,1,-7,0,0,1,0,0,0,"In-Service Training Grant, Basic Support Grant, IL Part B Grant, Older Blind Services Grant",-7,-7,0,0,1,0,1,0,-7,Community Foundation Grant,1,-7,1,Work closely with the SRC and the Commission Board of Directors and get their input; also do customer satisfaction surveys and meet with consumer organizations,1,95,RSA,1,-7,2,-7,-7,1,1,1,1,1,1,-7,0,0,0,1,1,0,1,0,0,0,1,1,0,"Division of VR, Commission for the Deaf and Hard of Hearing, Higher Education Dept., Highlands University, Health Dept., Long-Term Services Division, NM School for the Blind and Visually Impaired, Native American Programs",0,1,0,1,0,1,0,1,0,1,1,0,0,-7,0,0,0,1,0,0,0,0,0,0,0,0,0,-7,0,0,1,0,0,0,0,0,0,0,0,0,0,-7,0,0,0,0,0,0,0,0,0,0,0,0,1,-7,0,0,0,0,0,0,0,0,0,0,0,1,0,Commission for the Deaf and Hard of Hearing; Health Dept.,0,0,0,0,0,0,0,0,0,0,0,0,1,-7,0,0,0,0,0,0,0,0,0,0,0,0,1,-7,0,0,0,0,0,0,0,0,0,0,0,0,1,-7,0,0,0,0,0,1,0,0,0,0,0,1,0,Division of VR (use the same rate schedule that DVR negotiated with Health Dept. for SE),3,2,-7,2,-7,2,-7,-9,-7,-7,-7,2,-7,1,minimum wage $7.50 per hour,3,-7,3,-7,3,-7,3,-7,3,-7,2,-7,3,-7,3,-7,3,-7,2,-7,-7,-7,-7,-7,1,1,1,0,1,0,0,0,0,-7,0,0,0,1,1,0,0,-7,1,1,2,-7,1,1,2,-7,1,1,2, ,1,1,2,-7,-9,-7,-7,-7,2,-7,-7,-7,2,-7,-7,-7,2, ,-7,-7,-7,1,0,0,0,1,0,0,0,-7,1,Individuals who do not qualify for the DD waiver,-9129,9/19/11,NV,3,1,1,2,Deputy Administrator- Program Services,3,18,18,2,Nevada Rehabilitation Division,"Department of Employment, Training and Rehabilitation ( DETR)",Administrator,"Director of the Department of Employment, Training & Rehabilitation",1,Director of DETR,-7,Deputy Director of DETR,2,-7,-7,1,3,3,3,3,3,3,3,3,3,3,3,-9,3,1,1,3,2,99,1,99,99,1,-9,283,-9,-7,-7,137,-9,137,-9,-7,-7,-9,-7,-7,5,-9,5,127,127,14,-9,-7,-7,-9,-9,-7,-9,-7,-7,-7,0,33,0,2,0,0,0,3,36,9,0,3,6,6,0,0,-9,-7,3,1,1,1,1,1,1,1,-7,3,1,1,3,1,1,-7,95,State of Nevada,1,1,1,1,1,-7,1,-7,0,0,1,1,0,0,ARRA funds,Tobacco Grant,-7,0,1,0,0,1,0,-7,Gift Fund from private donations to be used for Blind or Visually Impaired,1,-7,1,Annual meeting with Administrative and management staff lead by contracted consultant.,1,1,-7,1,-7,2,-7,-7,1,1,1,1,1,1,-7,0,0,0,1,1,1,1,1,1,0,0,1,0,Community Training Centers,0,0,0,0,1,1,0,1,0,0,0,0,0,-7,0,0,0,0,1,0,1,1,0,0,0,1,0,"Nevada Equal Right Commission, DETR partners-Appeals office, Field Audit office",0,0,0,0,1,0,0,0,0,0,0,1,0,Reaching All Goals Efficiently (RAGE),0,0,0,0,0,0,0,0,0,0,0,0,1,-7,0,0,0,1,1,0,1,1,1,0,0,1,0,IL programs,0,0,0,0,1,1,1,0,0,0,0,0,0,-7,0,0,0,0,0,0,0,0,0,0,0,0,1,-7,0,0,0,0,0,0,0,0,0,0,0,0,1,-7,0,0,0,0,0,0,0,0,0,0,0,0,1,-7,121,2,-7,2,-7,2,-7,2,-7,-7,-7,2,-7,1,State or Federal Minimum rates,3,-7,3,-7,3,-7,2,-7,3,-7,2,-7,3,-7,3,-7,2,-7,2,-7,-7,-7,-7,-7,1,0,1,0,1,0,0,0,0,-7,0,0,0,1,1,0,0,-7,2,-7,-7,-7,1,1,2,-7,2,-7,-7, ,1,1,2,-7,2,-7,-7,-7,1,1,2,-7,2,-7,-7,-7,2, ,-7,-7,-7,2,0,0,0,0,0,0,1,-7,1,TBI and Autism Spectrum Disorders,-926,3/24/11,NY,1,1,2,1,-7,0,21,29,2,New York State Vocational Rehabilitation Services Program,New York State Department of Education,Assistant Commissioner,-9,1,Commissioner of Education,-7,Deputy Commissioner,2,-7,-7,3,1,3,3,3,1,3,3,3,3,3,-9,-7,3,3,3,1,3,3,3,3,1,2,-7,710,-9,-7,-7,-9,-7,-7,3,-9,3,-9,-7,-7,-9,-7,-7,707,707,-9,-9,-7,-7,-9,-9,-7,-9,-7,-7,-7,0,0,15,22,0,0,0,0,0,0,0,0,40,0,0,0,-9,-7,1,1,1,1,1,1,1,1,-7,1,1,1,1,1,1,-7,1,-7,1,1,1,1,1,-7,1,-7,0,0,1,0,0,0,VR Training Grant,-7,-7,0,0,0,1,0,0,Social Security Trust Fund,-7,1,-7,1,Designing Our Future Initiatives which was a developed plan in 2007,1,1,-7,1,-7,2,-7,-7,1,1,1,1,1,1,-7,0,0,1,1,1,1,1,1,0,1,0,0,0,-7,0,0,0,0,0,1,0,1,0,0,0,1,0,-9,0,0,0,0,0,0,0,0,0,0,0,0,1,-7,0,0,0,0,0,1,0,1,0,0,0,1,0,Commission F/T Blind,0,0,0,0,0,0,0,0,0,0,0,0,1,-7,0,0,0,0,0,1,0,1,0,0,0,1,0,Commission F/T Blind,0,0,1,1,1,1,1,1,0,1,0,0,0,-7,0,0,0,0,0,0,0,0,0,0,0,0,1,-7,0,0,0,0,0,0,0,0,0,0,0,0,1,-7,0,0,0,0,0,0,0,0,0,0,0,0,1,-7,2549,2,-7,1,90,1,10,2,-7,-7,-7,1,20,2,-7,2,-7,1,2549,3,-7,3,-7,3,-7,2,-7,2,-7,3,-7,2,-7,1,SED Extended Services (State-funded SE),state dollars,10000000,4080,Most significant disabilities with significant learning disability that does not qualify for service,1,1,0,0,0,0,0,0,0,-7,1,0,1,0,0,0,0,-7,1,1,1,1275,2,-7,-7,-7,1,1,1,1275,1,1,1,637,1,1,1,637,2,-7,-7,-7,2,-7,-7,-7,1,State funds for extended supports provided to the VR agency,1,1,637,2,0,0,0,1,1,1,0,Separate State VR agency for individuals who are blind,2,-7,"Extended services dollars for individuals who don't qualify for DD or MH agency dollars (funded under VR- program using special earmarked state dollars) are at their ceiling and will not be increased. Challenge to determine if some people, after years of successful supported employment, may no longer require ongoing supports through extended funding. Need to create capacity for those with the most need."102,2/28/11,OH,3,1,4,2,Deputy Director,1.5,17,19,1,Ohio Rehabilitation Services Commission,-7,Kevin Miller,-7,1,Governor,-7,-9,2,-7,-7,1,3,3,3,3,3,3,3,3,3,3,3,-9,3,3,1,1,99,99,1,99,1,2,-7,1238.9,-9,-7,-7,653.2,-9,653.2,-9,-7,-7,-9,-7,-7,13.6,11,2.6,461.79,428.5,33.3,-9,-7,-7,-9,-7,-7,110.31,-9,110.3,indirect cost funds,0,37,0,7,0,0,0,0,0,0,0,0,0,0,0,0,0,-9,1,1,1,1,1,1,1,1,-7,1,1,1,1,1,1,-7,1,-7,1,1,1,1,1,-7,1,-7,0,0,1,0,0,0,"RSA Transition Grant, HRSA Brain Injury Grant",-7,-7,0,0,1,1,0,0,Local Match Sources,-7,1,-7,-9,-7,1,1,-7,1,-7,2,-7,-7,1,1,3,1,1,1,-7,1,0,1,1,1,1,0,1,0,0,0,1,0,Bureau of Workers Compensation,0,0,0,0,0,0,0,0,0,0,0,0,1,-7,0,0,0,1,0,0,0,0,0,0,0,0,0,-7,1,0,0,0,0,0,0,0,0,0,0,1,0,Board of Regents,0,0,0,0,0,0,0,0,0,0,0,0,1,-7,0,0,0,0,0,0,0,0,0,0,0,1,0,"Board of Regents, Bureau of Workers Compensation",0,0,0,0,0,1,1,0,0,0,0,0,0,-7,0,0,0,0,0,0,0,0,0,0,0,0,1,-7,0,0,0,0,0,0,0,0,0,0,0,0,1,-7,0,0,0,0,0,0,0,0,0,0,0,0,1,-7,367,2,-7,2,-7,2,-7,2,-7,-7,-7,2,-7,2,-7,3,-7,3,-7,3,-7,2,-7,2,-7,2,-7,2,-7,3,-7,2,-7,2,-7,-7,-7,-7,-7,1,1,0,1,0,0,0,0,0,-7,0,0,0,1,1,0,0,-7,2,-7,-7,-7,2,-7,-7,-7,1,1,2, ,2,-9,-7,-7,2,-7,-7,-7,2,-7,-7,-7,2,-7,-7,-7,1,Ticket to Work reimbursements,1,2,-7,2,0,0,0,0,0,0,1,-7,1,disabilities other than MH or DD,-922,2/17/11,OK,3,1,4,1,-7,2,6,11,1,Oklahoma Department of Rehabilitation Services,-7,Executive Director,-7,95,-7,Unclassifed/Appointed by a Commission,Chairperson Oklahoma Commission for the Department of Rehabilitation,2,-7,-7,1,3,3,3,3,3,3,3,3,3,3,1,-9,3,3,1,1,3,3,1,3,1,1,"There are 9 agencies, Apache, Comanche, Cheyenne-Arapaho, Delaware, Muscogee Creek, Cherokee, Iowa, Choctaw, and Chickasaw",445,-9,-7,-7,369,-9,-9,11,-9,11,7,-9,7,14,-9,14,395,-9,-9,-9,-7,-7,-9,-7,-7,18,-9,18,library for the blind and physically handicapped,7,104,8,13,0,0,1,0,93,0,0,4,23,9,0,0,32,"Rehabiliatation Teachers of the Blind (17), Assistive Technology Specialists (8), Cold Case Unit (4)",3,1,1,1,1,1,1,1,-7,3,3,1,1,1,95,-9,95,-9,1,1,1,1,95,-9,1,-7,0,0,0,0,0,1,-7,-7,-7,0,0,0,1,0,0,legislature,-7,1,-7,1,A specifc team is assigned. Members of the SRC and SILC are involved. Public hearings are held across the state.,1,1,-7,1,-7,2,-7,-7,1,1,1,1,1,95,"We are primary, but there are certain purchases over certain limits we must get central service appproval",1,0,1,1,1,1,1,1,1,0,0,1,0,Career Technical Centers,0,0,0,0,0,1,0,1,0,0,0,0,0,-7,0,0,1,1,0,0,1,0,0,1,0,1,0,"most of our offices are independent, but we rent some common spaces",1,0,1,0,1,0,1,1,0,0,0,1,0,Office of Juvenile Affairs,0,0,0,0,0,0,0,0,0,0,0,0,1,-7,0,0,1,0,1,1,1,1,1,1,0,0,0,-7,0,0,0,0,0,0,0,0,0,0,0,0,1,-7,0,0,0,0,0,0,0,0,0,0,0,0,1,-7,0,0,0,0,0,0,0,0,0,0,0,0,1,-7,0,0,0,0,0,0,0,0,0,0,0,0,1,-7,360,3,-7,3,-7,1,-7,2,-7,-7,-7,1,20,1,federal minimum wage,3,-7,3,-7,3,-7,2,-7,2,-7,2,-7,2,-7,3,-7,2,-7,2,-7,-7,-7,-7,-7,1,1,0,0,1,0,0,0,0,-7,1,1,1,0,0,0,0,-7,2,-7,-7,-7,1,1,2,-7,2,-7,-7, ,2,-9,-7,-7,2,-7,-7,-7,1,1,2,-7,2,-7,-7,-7,2, ,-7,-7,-7,3,0,0,0,1,1,0,0,-7,2,-7,-9132,3/10/11,OR,1,1,3,1,-7,7,20,21,2,Oregon Office of Vocational Rehabilitation Services,Department of Human Services,Administrator,Administrator,3,-7,-7,Assistant Deputy Director for Children Adults and Families,2,-7,-7,2,3,2,3,3,3,3,2,3,2,3,-9,-7,99,99,99,1,99,99,99,99,1,2,-7,-9,-9,-7,-7,-9,-7,-7,0.5,-7,-7,-9,-7,-7,-9,-7,-7,-9,-7,-7,-9,-7,-7,2,-9,2,-9,-7,-7,-7,2,0,3,1,0,1,0,0,0,0,0,0,1,0,0,5,-9,-7,3,1,1,1,1,1,1,1,-7,1,1,1,1,1,95,shared services division,95,shared services division,1,1,1,1,1,-7,1,-7,1,0,1,0,0,0,RSA Five Year Demonstration Grant; Technology Grant,-7,-7,0,1,0,1,0,0,social security reimbursement,-7,2,-7,2,-7,2,2,-7,2,-7,1,LDMS,-9,1,1,1,1,1,1,-7,0,0,1,1,1,1,0,1,0,1,1,1,0,worker's comp,0,0,0,0,0,1,0,1,0,0,0,0,0,-7,0,0,0,0,0,0,0,0,0,1,0,1,0,Seniors and People with Disabilities; Child Welfare,-9,-9,-9,-9,-9,-9,-9,-9,-9,-9,-9,-9,-9,-7,-9,-9,-9,-9,-9,-9,-9,-9,-9,-9,-9,-9,-9,-7,0,0,0,0,0,0,0,1,0,0,0,0,0,-7,0,0,0,1,0,0,0,0,0,0,0,1,0,Department of Human Services (DSA),-9,-9,-9,-9,-9,-9,-9,-9,-9,-9,-9,-9,-9,-7,-9,-9,-9,-9,-9,-9,-9,-9,-9,-9,-9,-9,-9,-7,-9,-9,-9,-9,-9,-9,-9,-9,-9,-9,-9,-9,-9,-7,-9,-9,-7,-9,-7,-9,-7,-9,-7,-7,-7,2,-7,2,-7,3,-7,3,-7,3,-7,-9,-7,3,-7,-9,-7,-9,-7,-9,-7,-9,-7,2,-7,-7,-7,-7,-7,1,1,1,0,0,0,0,0,0,-7,0,0,0,1,0,0,0,-7,1,-9,-9,-7,1,-9,-9,-7,-9,-7,-7, ,1,-9,-9,-7,1,-9,-9,-7,-9,-7,-7,-7,-9,-7,-7,-7,-9, ,-7,-7,-7,2,-9,-9,-9,-9,-9,-9,-9,-7,1,Individuals with brain injury and physical disabilities who are not developmentally delayed,-9