160,4/5/11,OR,2,2,4,1,-7,10,33,33,1,Oregon Commission for the Blind,-7,Administrator,-7,1,Commission Board,-7,Commission Board,2,-7,-7,3,3,3,3,3,3,3,3,3,3,3,-9,-7,99,3,1,1,99,99,1,99,1,1,-9,47.6,-9,-7,-7,-9,-7,-7,8,-9,-9,-9,-7,-7,2.5,-9,-9,28.1,-9,-9,-9,-7,-7,-9,-9,-7,8.5,-9,-9,Administration,-9,47.6,1,0.5,-9,-9,-9,-9,35,-9,-9,5,2.5,1,-9,-9,7,Rehab Instructors (Also Other - 3.5 Technology Instructors),1,1,1,1,1,1,1,1,-7,1,1,1,1,1,1,-7,1,-7,1,1,1,1,1,-7,1,-7,0,0,1,0,0,0,ARRA,-7,-7,0,0,1,1,1,0,BEP Set Aside,Donations,1,-7,2,-7,2,1,-7,1,-7,2,-7,-7,1,1,1,1,1,1,-7,0,0,0,0,1,0,0,0,0,0,0,0,0,-7,0,0,0,0,0,1,0,1,0,0,0,0,0,-7,0,0,0,0,1,0,0,0,0,0,0,0,0,-7,0,0,0,0,1,0,0,0,0,0,0,0,0,-7,0,0,0,0,1,0,0,0,0,0,0,0,0,-7,0,0,0,0,1,0,0,0,0,0,0,0,0,-7,0,0,0,0,0,0,0,0,0,0,0,0,1,-7,0,0,0,0,0,0,0,0,0,0,0,0,1,-7,0,0,0,0,0,0,0,0,0,0,0,0,1,-7,0,0,0,0,0,0,0,0,0,0,0,0,1,-7,3,2,-7,2,-7,2,-7,2,-7,-7,-7,2,-7,2,-7,3,-7,3,-7,3,-7,2,-7,2,-7,2,-7,2,-7,3,-7,2,-7,2,-7,-7,-7,-7,-7,1,1,0,1,0,0,0,0,0,-7,0,1,0,0,1,0,0,-7,1,1,2,-7,2,-7,-7,-7,2,-7,-7, ,2,-9,-7,-7,2,-7,-7,-7,1,1,2,-7,2,-7,-7,-7,2, ,-7,-7,-7,2,0,0,0,0,0,0,1,-7,1,Brain injury,-9154,3/17/11,PR,3,1,1,2,Counseling Services Director,1,22,22,2,Peurto Rico Vocational Rehabilitation Administration,Department of Labor and Human Resources,Administrator,Secretary of the Department of Labor and Human Resources,95,-7,Administrative,Secretary of the Department of Labor and Human Resources,2,-7,-7,1,3,3,3,3,3,2,3,3,3,3,-9,-7,1,1,1,-9,2,2,1,3,1,2,-7,-9,-9,-7,-7,-9,-7,-7,-9,-7,-7,-9,-7,-7,-9,-7,-7,-9,-7,-7,-9,-7,-7,-9,-9,-7,-9,-7,-7,-7,-9,-9,-9,-9,-9,-9,-9,-9,-9,-9,-9,-9,-9,-9,-9,-9,-9,-7,1,1,1,1,1,1,1,1,-7,1,1,1,1,1,1,-7,1,-7,1,1,1,1,1,-7,1,-7,0,1,1,0,0,0,Randolph Sheppard,-7,-7,-9,-9,-9,-9,-9,-9,-7,-7,1,-7,1,"Guidelines, Regulations",1,1,-7,1,-7,1,The Strategic Plan responds to the State Plan,1,1,1,1,1,1,1,-7,0,0,1,0,1,1,1,1,1,0,1,0,0,-7,0,0,0,0,0,0,0,0,0,0,0,0,1,-7,0,0,0,0,0,0,0,0,0,0,0,0,1,-7,0,0,0,0,1,0,0,0,1,0,0,1,0,"State Insurance Fund, ACCA, Social Security",0,0,0,0,1,1,0,1,1,0,1,0,0,-7,0,0,0,0,1,0,0,1,1,0,0,0,0,-7,0,0,0,0,0,1,0,1,0,0,0,0,0,-7,0,0,0,0,0,0,0,0,0,0,0,0,1,-7,-9,-9,-9,-9,-9,-9,-9,-9,-9,-9,-9,-9,-9,-7,-9,-9,-9,-9,-9,-9,-9,-9,-9,-9,-9,-9,-9,-7,-9,-9,-7,-9,-7,-9,-7,-9,-7,-7,-7,-9,-7,-9,-7,-9,-7,-9,-7,-9,-7,-9,-7,-9,-7,-9,-7,-9,-7,-9,-7,-9,-7,-9,-7,-7,-7,-7,-7,-9,-9,-9,-9,-9,-9,-9,-9,-9,-7,-9,-9,-9,-9,-9,-9,-9,-7,-9,-7,-7,-7,-9,-7,-7,-7,-9,-7,-7, ,-9,-9,-7,-7,-9,-7,-7,-7,-9,-7,-7,-7,-9,-7,-7,-7,-9, ,-7,-7,-7,-9,-9,-9,-9,-9,-9,-9,-9,-7,-9,-7,-910,1/26/11,RI,3,1,3,1,-7,3,19,19,2,Rhode Island Office of Rehabilitation Services,Department of Human Services,Administrator,-9,3,-7,-7,Director,2,-7,-7,1,3,3,3,3,3,3,3,3,3,3,1,-9,1,3,1,1,99,99,1,99,1,2,-7,72,1,-7,-7,50,-9,-9,1,-7,-7,3,3,-9,4,-9,-9,72,72,-9,-9,-7,-7,3,1,2,-9,-7,-7,-7,4,34,2,3,19,0,2,10,2,0,0,2,17,0,3,0,-9,-7,3,1,1,1,1,1,1,1,-7,1,1,1,1,1,1,-7,1,-7,1,1,1,1,1,-7,1,-7,0,1,1,0,0,0,"ATAP, ATEL, PCA",-7,-7,0,0,1,1,1,0,"SS reimbursement, reallotment",-9,1,-7,1,5yr plan,1,1,-7,1,-7,2,-7,-7,1,1,1,1,1,1,-7,1,0,1,1,1,1,1,1,1,1,1,1,0,Substance Abuse,0,0,1,0,1,1,1,1,0,0,1,0,0,-7,0,0,0,0,0,0,1,0,0,0,0,0,0,-7,0,0,0,0,0,1,0,0,0,0,0,1,0,State Education Authorities,0,0,0,0,0,0,0,0,0,0,0,0,1,-7,0,0,0,0,0,1,0,1,0,0,0,1,0,State Education Agency,0,0,1,1,1,1,1,1,0,1,1,0,0,-7,0,0,1,0,1,1,1,1,0,1,1,0,0,-7,0,0,1,0,1,1,0,1,0,1,1,0,0,-7,0,0,1,0,0,0,0,0,0,0,1,0,0,-7,74,2,-7,2,-7,2,-7,1,-9,2,-7,2,-7,1,state minimum wage,3,-7,3,-7,3,-7,2,-7,2,-7,2,-7,2,-7,3,-7,3,-7,2,-7,-7,-7,-7,-7,1,1,1,1,1,0,0,0,0,-7,1,0,1,0,0,1,0,State policy,2,-7,-7,-7,2,-7,-7,-7,2,-7,-7, ,2,-9,-7,-7,2,-7,-7,-7,1,1,2,-7,2,-7,-7,-7,2, ,-7,-7,-7,1,0,0,0,1,1,0,0,-7,2,-7,-940,2/17/11,SC,1,1,4,2,"Assistant Commissioner, Client Services",4,18,18,1,South Carolina Vocational Rehabilitation Department,-7,Commissioner,-7,1,"Board, SCVRD Independent Commission",-7,"Board Chairman, SCVRD Independent Commission",2,-7,-7,1,3,3,3,3,3,3,3,3,3,3,3,-9,3,3,3,1,99,3,3,99,1,2,-7,1175,-9,-7,-7,-9,-7,-7,-9,-7,-7,-9,-7,-7,-9,-7,-7,-9,-7,-7,-9,-7,-7,-9,-9,-7,-9,-7,-7,-7,-9,-9,-9,-9,-9,-9,-9,-9,-9,-9,-9,-9,-9,-9,-9,-9,-9,-7,1,1,1,1,1,1,1,1,-7,1,1,1,1,1,1,-7,1,-7,1,1,1,1,1,-7,1,-7,0,1,1,1,1,0,Transition Services & (FED) Telework E Tech Loan Program,State W.I.A.,RSA Training Grant,1,1,1,0,0,0,-7,-7,1,-7,1,Strategic plan is based on the Baldrige criteria,1,1,-7,1,-7,1,SC state program based on Baldrige,2,1,1,1,1,1,1,-7,1,0,1,1,1,1,1,1,1,1,1,0,0,-7,0,0,0,0,1,1,0,1,0,0,0,0,0,-7,1,0,1,1,1,0,1,1,1,1,1,1,0,SC Commission for the Blind,1,0,0,0,1,0,0,1,0,0,0,0,0,-7,1,0,0,0,1,0,0,1,0,0,1,0,0,-7,0,0,0,0,0,1,0,0,0,0,0,0,0,-7,1,0,0,1,1,1,1,1,1,0,1,1,0,"ORS, DEW-Wage Verification, SVES-SSA-DSS",0,0,0,0,0,0,0,0,0,0,0,0,1,-7,0,0,0,0,0,0,0,0,0,0,0,0,1,-7,0,0,0,0,0,0,0,0,0,0,0,1,0,"Health & Human Services, Dept. of Health & Enviornmental Control",-9,-9,-7,-9,-7,-9,-7,-9,-7,-7,-7,-9,-7,-9,-7,-9,-7,-9,-7,-9,-7,-9,-7,-9,-7,-9,-7,-9,-7,-9,-7,-9,-7,-9,-7,-7,-7,-7,-7,-9,-9,-9,-9,-9,-9,-9,-9,-9,-7,-9,-9,-9,-9,-9,-9,-9,-7,2,-7,-7,-7,-9,-7,-9,-7,2,-7,-7, ,2,-9,-7,-7,2,-7,-7,-7,-9,-7,-7,-7,2,-7,-7,-7,-9, ,-7,-7,-7,2,0,0,0,0,0,0,1,-7,-9,-7,-9157,3/22/11,SC,2,2,4,1,-7,38,6,38,1,South Carolina Commission for the Blind,-7,Commissioner,-7,1,Board of Commissioners,-7,Board of Commissioners,2,-7,-7,3,3,3,3,3,3,3,3,3,3,3,-9,-7,1,3,1,1,3,3,1,3,1,2,-7,96,15,13.78,1.22,-9,-7,-7,2,1.95,0.05,-9,-7,-7,12,9.54,2.46,36,31.7,4.3,-9,-7,-7,-9,-9,-7,-9,-7,-7,-7,-9,-9,4,-9,-9,-9,-9,-9,4,-9,-9,4,2,1,-9,-9,-9,-7,1,1,1,1,1,1,1,1,-7,1,1,1,1,1,1,-7,1,-7,1,1,1,1,1,-7,1,-7,0,0,1,0,0,0,"Basic Support and Supported Employment, IDL-B, Training, Older Blind",-7,-7,0,0,0,0,1,0,-7,Call Center Training,1,-7,1,Quality Assurance Director meets with respective staff for development,1,1,-7,1,-7,1,Accountability Report,1,1,1,1,1,1,1,-7,0,0,0,0,0,0,0,0,0,0,0,0,1,-7,0,0,0,0,0,0,0,0,0,0,0,0,1,-7,0,0,0,0,0,0,0,0,0,0,0,1,0,South Carolina Vocational Rehabilitation Department,0,0,0,0,0,0,0,0,0,0,0,0,1,-7,0,0,0,0,0,0,0,0,0,0,0,0,1,-7,0,0,0,0,0,0,0,0,0,0,0,1,0,South Carolina Vocational Rehabilitation Department,0,0,0,0,0,0,0,0,0,0,0,0,1,-7,0,0,0,0,0,0,0,0,0,0,0,0,1,-7,0,0,0,0,0,0,0,0,0,0,0,0,1,-7,0,0,0,0,0,0,0,0,0,0,0,0,1,-7,0,3,-7,3,-7,1,-9,2,-7,-7,-7,2,-7,2,-7,2,-7,2,-7,2,-7,2,-7,2,-7,2,-7,2,-7,3,-7,2,-7,2,-7,-7,-7,-7,-7,0,0,0,0,0,0,0,0,1,-7,0,0,0,0,0,0,1,-7,2,-7,-7,-7,2,-7,-7,-7,2,-7,-7, ,2,-9,-7,-7,2,-7,-7,-7,2,-7,-7,-7,2,-7,-7,-7,2, ,-7,-7,-7,2,0,0,0,0,0,0,1,-7,2,-7,-919,1/19/11,SD,1,1,3,1,-7,20,25,40,2,South Dakota Division of Rehabilitation Services,Department of Human Services,Division Director,Department Secretary,1,Department Secretary,-7,Department Secretary,2,-7,-7,1,3,2,3,2,3,3,3,2,3,3,-9,-7,1,3,2,1,3,3,3,3,1,1,Four different Nations have grants,100,1,1,-7,35,-9,35,1,1,-7,1,1,-7,-9,-7,-7,55,55,-9,-9,-7,-7,1,1,-7,-9,-7,-7,-7,0,0,0,1,0,0,0,0,7,0,0,0,0,0,0,0,-9,-7,2,1,1,1,1,2,1,1,-7,1,1,1,3,1,1,-7,95,Bureau of Information Technology,1,2,1,1,1,-7,1,-7,1,1,0,0,0,0,-7,-7,-7,1,0,1,1,0,0,Social Security Administration,-7,1,-7,1,Related to the VR stae plan,1,1,-7,1,-7,1,Utah Consortium,2,1,1,1,1,1,1,-7,0,0,1,0,1,1,1,1,1,0,1,0,0,-7,0,0,1,0,1,1,0,1,0,0,0,0,0,-7,0,0,0,0,0,1,1,1,0,0,1,0,0,-7,0,0,1,0,1,1,1,1,1,0,1,0,0,-7,0,0,1,0,0,0,0,0,0,0,1,0,0,-7,0,0,1,0,1,1,1,1,0,0,1,0,0,-7,0,0,1,0,1,1,1,1,1,0,1,0,0,-7,0,0,1,0,1,1,1,1,0,0,0,0,0,-7,0,0,1,0,1,1,1,1,0,0,0,0,0,-7,0,0,1,0,1,1,1,1,0,0,0,0,0,-7,150,2,-7,2,-7,2,-7,2,-7,-7,-7,2,-7,1,Federal minimum,1,150,1,0,1,0,2,-7,2,-7,2,-7,2,-7,3,-7,3,-7,2,-7,-7,-7,-7,-7,1,1,0,0,1,1,0,0,0,-7,1,1,0,0,1,0,0,-7,1,1,2,-7,1,1,2,-7,1,1,2, ,1,1,2,-7,2,-7,-7,-7,1,1,2,-7,2,-7,-7,-7,2, ,-7,-7,-7,2,0,1,1,1,1,0,0,-7,2,-7,-948,2/9/11,SD,2,2,3,1,-7,5,21,21,2,South Dakota Service to the Blind and Visually Impaired,Department of Human Services,Director,Department Secretary,1,Governor,-7,Department Secretary,2,-7,-7,1,3,1,1,1,1,2,1,1,1,3,-9,-7,1,3,1,1,1,1,1,99,1,1,Tribes,29,-9,-7,-7,-9,-7,-7,-9,-7,-7,-9,-7,-7,1,1,-7,21,21,-9,-9,-7,-7,-9,-9,-7,-9,-7,-7,-7,0,29.2,1,0,0,0,0,0,0,0,0,2,0,0.5,0,0,-9,-7,1,1,1,1,1,1,1,1,-7,1,1,1,1,1,1,-7,1,-7,1,1,1,1,1,-7,1,-7,0,0,0,0,0,1,-7,-7,-7,0,0,0,1,1,0,Social Security Reimbursements,Donations,1,-7,2,-7,1,1,-7,1,-7,2,-7,-7,1,1,1,1,1,1,-7,1,0,0,0,1,1,1,1,0,0,1,0,0,-7,0,0,0,0,0,1,0,0,0,0,0,0,0,-7,0,0,0,0,0,1,1,0,0,0,1,0,0,-7,0,0,0,0,1,1,0,1,0,0,0,0,0,-7,0,0,0,0,0,0,0,0,0,0,0,1,0,SD School for the Blind and Visually Impaired,0,0,0,0,1,1,0,1,0,0,0,0,0,-7,0,0,0,0,1,0,1,0,0,0,0,0,0,-7,0,0,0,0,0,0,0,0,0,0,0,0,1,-7,0,0,0,0,0,0,0,0,0,0,0,0,1,-7,0,0,0,0,0,0,0,0,0,0,0,0,1,-7,6,2,-7,2,-7,2,-7,2,-7,-7,-7,2,-7,2,-7,2,-7,3,-7,2,-7,3,-7,3,-7,2,-7,2,-7,3,-7,2,-7,2,-7,-7,-7,-7,-7,1,1,0,0,0,1,0,0,0,-7,1,0,1,0,0,0,0,-7,1,1,2,-7,2,-7,-7,-7,1,1,2, ,1,1,2,-7,2,-7,-7,-7,2,-7,-7,-7,2,-7,-7,-7,2, ,-7,-7,-7,1,0,1,1,1,1,0,0,-7,2,-7,-9137,3/11/11,TN,3,1,3,2,"Director, VR",1,5,5,2,Tennessee Division of Vocational Rehabilitation,Department of Human Services,Assistant Commissioner,-9,1,"Governor, via Commissioner, Human Services",-7,"Commissioner, Human Services",2,-7,-7,1,3,3,3,3,3,3,3,3,3,3,-9,-7,1,3,1,1,3,3,1,3,1,2,-7,-9,-9,-7,-7,-9,-7,-7,-9,-7,-7,-9,-7,-7,-9,-7,-7,-9,-7,-7,-9,-7,-7,-9,-9,-7,-9,-7,-7,-7,-9,-9,-9,-9,-9,-9,-9,-9,-9,-9,-9,-9,-9,-9,-9,-9,-9,-7,1,1,1,1,1,1,1,1,-7,3,3,3,3,1,95,-9,95,-9,1,1,1,1,1,-7,1,-7,0,0,1,0,0,0,Training Grants,-7,-7,1,0,1,0,0,0,-7,-7,1,-7,1,Planning process includes both Central Office staff and Regional Supervisors,1,1,-7,1,-7,2,-7,-7,1,1,1,1,1,1,-7,1,0,1,1,1,1,1,1,1,1,1,0,0,-7,0,0,0,0,0,1,0,1,0,0,0,0,0,-7,0,0,1,1,0,0,0,0,0,0,0,0,0,-7,0,0,1,1,1,0,1,0,0,0,0,0,0,-7,0,0,1,0,0,0,0,0,0,0,0,0,0,-7,0,0,0,0,0,0,0,0,0,0,0,0,1,-7,0,0,0,0,0,0,0,0,0,0,0,0,1,-7,0,0,0,0,0,0,0,0,0,0,0,0,1,-7,0,0,0,0,0,0,0,0,0,0,0,0,1,-7,0,0,0,0,0,0,0,0,0,0,0,0,1,-7,-9,-9,-7,-9,-7,-9,-7,-9,-7,-7,-7,2,-7,2,-7,2,-7,3,-7,3,-7,2,-7,3,-7,2,-7,3,-7,3,-7,2,-7,2,-7,-7,-7,-7,-7,1,1,1,0,1,0,0,0,0,-7,1,1,0,0,1,0,0,-7,1,1,2,-7,2,-7,-7,-7,1,1,2, ,2,-9,-7,-7,1,1,2,-7,2,-7,-7,-7,2,-7,-7,-7,2, ,-7,-7,-7,3,0,0,0,1,1,0,0,-7,1,Very difficult to get funding for those not under the waiver,-9130,3/15/11,TX,1,1,5,1,-7,3,6,10,2,Texas Division of Rehabilitation Services,Department of Assistive and Rehabilitative Services,Assistant Commissioner,Commissioner,3,-7,-7,Commissoner,1,1,Went from Free standing agency with statewide board to being part of Health And Human Services Commission,2,3,3,3,3,3,3,3,3,3,3,3,-9,99,3,2,1,3,3,2,99,1,2,-7,1365,-9,-7,-7,-9,-7,-7,11,-9,-9,8,-9,-9,-9,-7,-7,1344,-9,-9,-9,-7,-7,-9,-9,-7,-9,-7,-7,-7,0,0,8,82,0,2,2,3,300,0,1,0,103,0,0,3,-9,-7,3,3,1,1,2,1,1,95,Health and Human Services,3,3,2,2,1,2,-7,2,-7,2,2,1,1,1,-7,1,-7,1,0,0,0,0,0,-7,-7,-7,0,0,0,1,0,0,SSA Reimbursement,-7,1,-7,1,State Plan and internal 3 year business plan,1,1,-7,1,-7,2,-7,-7,1,1,1,1,1,1,-7,0,0,1,1,0,1,0,1,1,0,1,0,0,-7,0,0,0,0,0,1,0,1,0,0,1,0,0,-7,0,0,0,0,0,0,0,0,0,1,0,1,0,Health and Human Services,0,0,0,0,0,1,0,0,1,0,0,0,0,-7,0,0,0,0,0,0,0,0,0,0,0,0,1,-7,0,0,0,0,0,1,0,1,1,0,0,0,0,-7,0,0,0,1,0,1,0,1,1,0,0,0,0,-7,0,0,0,0,0,0,0,0,0,0,0,0,1,-7,0,0,0,0,0,0,0,0,0,0,0,0,1,-7,0,0,0,0,0,0,0,0,0,0,0,0,1,-7,1275,2,-7,2,-7,2,-7,1,"waiver services, ticket to work",2,-7,2,-7,1,minimum or above,3,-7,3,-7,3,-7,2,-7,2,-7,2,-7,3,-7,3,-7,2,-7,2,-7,-7,-7,-7,-7,1,1,1,0,1,0,1,0,0,-7,1,1,1,0,0,0,0,-7,2,-7,-7,-7,1,1,2,-7,1,1,2, ,2,-9,-7,-7,1,1,2,-7,2,-7,-7,-7,2,-7,-7,-7,1,Ticket - SSA,1,2,-7,3,1,0,0,1,1,0,0,-7,2,-7,-9113,3/3/11,TX,2,2,5,2,Special Asst. to the Asst. Commissioner,9,40,40,2,Texas Division for Blind Services,Department of Assistive and Rehabilitative Services,Assistant Commissioner,Commissioner,3,-7,-7,Commissioner of DARS,2,-7,-7,2,3,3,3,3,3,3,3,3,3,3,3,-9,3,3,1,2,99,99,1,99,1,2,-7,466,-9,-7,-7,-9,-7,-7,70,70,-9,-9,-7,-7,18,-9,18,413,413,-9,-9,-7,-7,-9,-7,-7,-9,-7,-7,-7,0,466,18,0,0,0,0,0,0,0,0,14,23,0,0,0,4,Vocational Diagnostic Unit,1,1,1,1,1,1,1,95,HHSC (Parent Agency of DARS),3,3,1,2,2,95,Texas Facilities Commission,2,-7,1,1,1,1,1,-7,1,-7,1,0,0,0,0,0,-7,-7,-7,0,0,0,1,0,0,$1.00 check off on renewal of driver's license,-7,1,-7,2,-7,1,2,-7,1,-7,1,Working with Region VI TACE,2,1,1,2,1,2,2,-7,0,0,0,1,1,0,1,0,1,0,0,0,0,-7,0,0,0,0,0,0,0,0,0,0,0,0,1,-7,0,0,0,0,0,0,0,0,0,0,0,0,1,-7,0,0,0,0,1,0,0,0,0,0,0,0,0,-7,0,0,0,0,0,0,0,0,0,0,0,0,1,-7,0,0,0,0,0,0,0,0,0,0,0,0,1,-7,0,0,0,0,0,1,1,0,0,0,0,0,0,-7,0,0,0,0,0,0,0,0,0,0,0,0,1,-7,0,0,0,0,0,0,0,0,0,0,0,0,1,-7,0,0,0,0,0,0,0,0,0,0,0,0,1,-7,-9,2,-7,2,-7,2,-7,2,-7,-7,-7,2,-7,2,-7,2,-7,3,-7,3,-7,3,-7,3,-7,2,-7,2,-7,3,-7,2,-7,2,-7,-7,-7,-7,-7,1,1,1,0,1,0,0,0,0,-7,1,0,0,0,0,0,0,-7,2,-7,-7,-7,2,-7,-7,-7,2,-7,-7, ,2,-9,-7,-7,2,-7,-7,-7,2,-7,-7,-7,2,-7,-7,-7,2, ,-7,-7,-7,3,0,0,0,0,0,0,1,-7,2,-7,-925,3/24/11,UT,3,1,2,1,-7,4,42,42,2,Utah State Office of Rehabilitation,Utah State Board of Education,Executive Director,State Superintendent of Public Education,1,State Superintendent of Public Education,-7,Deputy Superintendent,2,-7,-7,1,3,3,3,3,2,3,3,3,3,3,-9,-7,3,3,1,1,1,3,1,3,1,2,-7,604,-9,-7,-7,118,-9,118,2,-9,2,1,-7,1,4,-9,4,308,308,-9,-9,-7,-7,2,-9,2,169,-9,169,Deaf Div and Blind Div,11,51,12,26,4,0,0,1,11,0,0,4,10,12,0,0,0,-9,1,1,1,1,1,1,1,1,-7,1,1,1,1,1,1,-7,1,-7,1,1,1,1,1,-7,1,-7,1,1,1,0,0,0,Supported Employment,-7,-7,1,0,1,1,0,0,Social Security Administration,-7,1,-7,2,-7,2,1,-7,1,-7,1,We initiated and are still involved with the Program Evaluation Summit Group and the IRA on PE/QA.,2,1,1,1,1,1,1,-7,0,0,1,0,1,1,1,0,0,0,1,0,0,-7,0,0,0,0,0,1,0,1,0,0,0,0,0,-7,0,0,0,0,0,0,0,0,0,0,1,0,0,-7,0,0,0,0,0,1,1,0,0,0,0,0,0,-7,0,0,0,0,0,0,1,0,0,0,0,0,0,-7,0,0,1,0,0,1,1,1,1,0,1,0,0,-7,0,0,0,0,1,0,1,0,0,0,0,0,0,-7,0,0,0,0,0,1,0,0,0,0,0,0,0,-7,0,0,0,0,0,0,0,0,0,0,0,0,1,-7,0,0,0,0,0,1,0,0,0,0,0,0,0,-7,44,3,-7,1,40,1,60,2,-7,-7,-7,1,20,1,minimum wage,1,10,1,27,1,0,1,4,1,3,2,-7,2,-7,1,0,2,-7,2,-7,-7,-7,-7,-7,1,1,1,0,1,0,0,0,0,-7,1,0,0,0,0,0,0,-7,1,1,2,-7,1,1,2,-7,1,1,2, ,1,1,2,-7,2,-7,-7,-7,1,1,2,-7,2,-7,-7,-7,2, ,-7,-7,-7,2,0,0,0,1,0,0,0,-7,1,Those on DD agency list,-965,4/7/11,VA,1,1,4,1,-7,9,17,17,1,Virginia Department of Rehabilitative Services,-7,Commissioner,-7,1,Governor,-7,Secretary of Health and Human Resources,2,-7,-7,1,3,3,3,3,3,3,3,3,3,3,3,-9,1,3,1,1,99,99,1,99,1,2,-7,1218.35,3,-9,3,458,-9,458,4,-9,4,4,-9,4,-9,-7,-7,579,579,-9,4,-9,4,-9,-7,-7,-9,-7,-7,-7,2,0,29,16,0,0,0,11,53,0,16,0,10,29,4,0,0,-9,1,1,1,1,1,1,1,1,-7,3,1,3,3,1,1,-7,1,-7,1,1,1,1,1,-7,1,-7,0,0,1,1,1,0,NIDRR Disability Research Project- subrecipient; DOL DEI -sub-recipient; MIG 'pass thru',WIA Discretionary,Autism Speaks,1,1,1,0,0,0,-7,-7,1,-7,1,Agency strategic plan developed on biennial basis using format provided by Governor'sOffice,1,1,-7,1,-7,2,-7,-7,1,1,1,1,1,1,-7,0,0,0,1,1,0,0,0,0,1,0,0,0,-7,0,0,0,0,0,0,0,0,0,0,0,0,1,-7,0,0,1,1,1,0,0,0,1,1,0,1,0,Virginia Employment Commission; local community service boards;,0,0,0,0,1,0,0,0,0,0,0,0,0,-7,0,0,0,0,0,0,0,0,0,1,0,1,0,Substance Abuse,0,0,0,0,0,0,0,0,0,1,0,1,0,Substance Abuse,0,0,0,0,0,0,0,1,0,1,0,1,0,Substance abuse,0,0,0,0,0,0,0,0,0,0,0,0,1,-7,0,0,0,0,0,0,0,0,0,0,0,0,1,-7,0,0,0,0,0,0,0,0,0,0,0,1,0,Medical Assistance Services,1088,3,-7,1,79,2,-7,1,Long term employment support services & extended employment services,-7,-7,2,-7,2,-7,2,-7,1,1088,1,6,3,-7,3,-7,2,-7,3,-7,3,-7,2,-7,1,Long term employment support services & extended support services,State funds,7617489,3088,"intellectual, serious mental illness, sensory/physical, cognitive, brain injury, autism, learning di",0,1,1,1,0,0,0,0,0,-7,1,1,0,0,0,0,0,-7,2,-7,-7,-7,2,-7,-7,-7,2,-7,-7, ,2,-9,-7,-7,2,-7,-7,-7,2,-7,-7,-7,2,-7,-7,-7,1,Partnership Plus,1,2,-7,2,0,1,0,0,0,0,0,-7,2,-7,-991,2/16/11,VA,2,2,4,2,Vocational Rehabilitation Program Director,7,7,19,1,Virginia Department for the Blind and Vision Impaired,-7,Commissioner,-7,1,Governor,-7,Secretary of Health and Human Resources,2,-7,-7,3,3,3,3,3,3,3,3,3,3,3,-9,-7,3,3,1,3,3,3,1,3,1,2,-7,178,-9,-7,-7,-9,-7,-7,-9,-7,-7,-9,-7,-7,1,1,-7,152,48.9,-9,-9,-7,-7,-9,-7,-7,-9,-7,-7,-7,0,-9,-9,0,0,0,0,0,-9,0,0,0,3,1,0,0,-9,-7,1,1,1,1,1,1,1,1,-7,1,1,1,3,1,1,-7,95,-9,3,1,1,1,1,-7,1,-7,0,0,1,0,0,0,In-Service Training Grant; Supported Employment Grant,-7,-7,-9,-9,-9,-9,-9,-9,-7,-7,1,-7,1,Strategic Planning process determined by the state Department of Planning and Budget,1,1,-7,1,-7,2,-7,-7,1,3,3,1,1,1,-7,0,0,0,1,0,0,0,0,0,0,0,1,0,Virginia Department of Rehabilitative Services,0,0,0,0,0,0,0,0,0,0,0,0,1,-7,0,0,0,1,0,0,0,0,0,0,0,1,0,Virginia Employment Commission,0,0,0,0,0,0,0,0,0,0,0,1,0,Virginia Department of Rehabilitative Services,0,0,0,0,0,0,0,0,0,0,0,0,1,-7,0,0,0,0,0,0,0,0,0,0,0,1,0,Virginia Department of Rehabilitative Services,0,0,0,0,1,0,1,0,0,0,0,1,0,"Virginia Employment Commission, Virginia Department of Rehabilitative Services",0,0,0,0,0,0,0,0,0,0,0,0,1,-7,0,0,0,0,0,0,0,0,0,0,0,0,1,-7,0,0,0,0,0,0,0,0,0,0,0,1,0,Virginia Department of Rehabilitative Services; Virginia Department for the Deaf and Hard of Hearing,-9,2,-7,-9,-7,-9,-7,1,Long-term follow-along services,1,100,2,-7,1,minimum wage,-9,-7,3,-7,2,-7,2,-7,2,-7,2,-7,-9,-7,-9,-7,2,-7,2,-7,-7,-7,-7,-7,1,1,1,1,1,0,1,0,0,-7,1,1,0,0,0,0,0,-7,2,-7,-7,-7,1,1,2,-7,2,-7,-7, ,2,-9,-7,-7,2,-7,-7,-7,2,-7,-7,-7,2,-7,-7,-7,1,state general funds designated for supported employment,1,-9,-7,3,0,0,0,1,1,0,0,-7,2,-7,-972,2/8/11,VI,3,1,3,1,-7,3,6,6,1,Virgin Islands Division of Disibilities and Vocational Rehabilitation Services,-7,Administrator,-7,1,Governor,-7,Assistant commissioner,2,-7,-7,3,3,3,3,3,3,3,3,3,3,3,3,-9,3,1,1,3,3,3,1,3,1,2,-7,19,-9,-7,-7,-9,-7,-7,-9,-7,-7,-9,-7,-7,-9,-7,-7,-9,-7,-7,-9,-7,-7,-9,-9,-7,-9,-7,-7,-7,0,1,0,0,0,0,0,0,0,0,0,0,0,0,0,0,-9,-7,1,1,1,1,1,1,1,95,-9,-9,-9,-9,-9,-9,1,-7,1,-7,1,3,3,3,1,-7,1,-7,0,0,0,0,0,1,-7,-7,-7,0,0,0,0,0,1,-7,-7,1,-7,2,-7,2,1,-7,1,-7,2,-7,-7,1,1,1,1,1,1,-7,0,0,1,1,1,1,1,1,0,1,0,0,0,-7,0,0,0,0,1,0,1,0,0,1,0,0,0,-7,0,0,0,0,0,0,0,0,0,0,0,0,1,-7,0,0,0,0,1,0,0,1,0,0,0,0,0,-7,0,0,0,0,0,0,0,0,0,0,0,0,1,-7,0,0,0,0,0,0,0,0,0,0,0,0,1,-7,0,0,0,1,0,0,0,0,0,0,0,0,0,-7,0,0,0,0,0,0,0,0,0,0,0,0,1,-7,0,0,0,0,0,0,0,0,0,0,0,0,1,-7,0,0,0,0,0,0,0,0,0,0,0,0,1,-7,37,3,-7,2,-7,2,-7,2,-7,-7,-7,2,-7,2,-7,2,-7,3,-7,1,5,2,-7,2,-7,2,-7,2,-7,3,-7,-9,-7,2,-7,-7,-7,-7,-7,0,1,1,1,1,0,1,0,0,-7,0,0,0,0,0,0,1,-7,2,-7,-7,-7,2,-7,-7,-7,2,-7,-7, ,2,-9,-7,-7,2,-7,-7,-7,2,-7,-7,-7,2,-7,-7,-7,2, ,-7,-7,-7,2,0,0,0,0,0,0,1,-7,2,-7,-9155,3/18/11,VT,1,1,3,1,-7,20,30,30,2,Vermont Division of Vocational Rehabilitation,Vermont Agency of Human Services,VR Director,Agency Secretary,2,-7,-7,"Commissioner of the Department of Disabilities, Aging and Independent living",2,-7,-7,2,3,2,2,2,3,3,2,2,2,3,-9,-7,1,3,1,3,99,3,1,99,1,2,-7,125,5,-9,5,-9,-7,-7,-9,-7,-7,-9,-7,-7,-9,-7,-7,104.8,-9,-9,11.2,-9,11.2,1,-7,1,3,-9,3,"2 FTE MIG, 1 FTE BOND",7,0,4,4,12,0,10,10,3,0,0,0,16,0,11.2,0,0,-9,3,1,1,1,1,1,1,1,-7,1,1,1,2,1,1,-7,2,-7,1,1,1,1,1,-7,1,-7,1,1,1,0,0,0,BOND,-7,-7,1,1,1,1,1,0,Ticket to Work,EAP Program Revenue,1,-7,1,"There is a structured needs assessment through a customer satisfaction survey, employer survey, staff survey, and consumer data analysis that is",1,1,-7,1,-7,1,We have done the Baldrige staff survey.,2,1,1,1,1,1,1,-7,1,0,1,0,1,1,1,1,1,1,0,0,0,-7,0,0,0,0,0,1,0,1,0,0,0,0,0,-7,1,0,0,0,0,0,1,0,0,1,0,1,0,Department of Children and Families,0,0,0,0,0,1,0,1,0,1,0,0,0,-7,1,0,0,0,0,1,0,1,0,1,0,0,0,-7,0,0,0,0,0,1,0,1,0,1,0,0,0,-7,1,0,0,0,1,1,1,1,0,1,0,0,0,-7,0,0,0,0,0,0,0,0,0,0,0,0,1,-7,0,0,0,0,0,1,0,1,0,0,0,0,0,-7,0,0,0,0,0,0,0,0,0,0,0,0,1,-7,323,2,-7,2,-7,1,-9,1,long term supports are provided by the DD and MH system,2,-7,2,-7,1,minimum wage or higher,2,-7,-9,-7,1,4,2,-7,2,-7,2,-7,2,-7,3,-7,2,-7,2,-7,-7,-7,-7,-7,0,1,0,0,0,0,0,0,0,-7,1,0,0,0,0,0,0,-7,2,-7,-7,-7,1,1,2,-7,1,1,1,750,2,-9,-7,-7,1,1,1,391,1,1,2,-7,2,-7,-7,-7,2, ,-7,-7,-7,2,0,1,0,1,0,0,0,-7,1,"Individuals with IQs over the 70 threshold, individuals with significant mental health issues who do not meet CRT criteria in MH, individuals with TBI who do not meet HCB waiver criteria.",-958,2/25/11,VT,2,2,3,1,-7,9,9,9,2,Vermont State Division for the Blind and Visually Impaired,Vermont Agency of Human Services,Director of the Division for the Blind and Visually Impaired,Secretary of the Agency of Human Services,2,-7,-7,"Commissioner of the Department of Disability, Aging, and Independent Living",2,-7,-7,2,3,2,2,2,3,3,2,2,2,3,-9,-7,1,3,1,1,-9,1,1,3,1,2,-7,10,-9,-7,-7,-9,-7,-7,3,3,-9,-9,-7,-7,0.5,-7,0.5,6.5,6.5,-9,-9,-7,-7,-9,-9,-7,-9,-7,-7,-7,0,10,0,0,0,0,0,0,0,0,0,0,0,0,0,0,-9,-7,2,1,1,1,1,1,1,1,-7,2,2,2,2,2,2,-7,1,-7,1,1,1,1,1,-7,1,-7,0,0,0,0,0,1,-7,-7,-7,0,0,0,0,0,1,-7,-7,1,-7,1,Comprehensive 3-year Needs Assessment and Strategic planning with SRC,1,1,-7,1,-7,2,-7,-7,1,1,1,1,2,1,-7,0,0,0,0,1,0,1,1,0,0,0,1,0,Department of Education,0,0,0,0,0,1,0,1,0,0,0,0,0,-7,0,0,0,0,0,0,0,0,0,0,0,0,1,-7,0,0,0,0,0,1,0,1,0,0,0,0,0,-7,0,0,0,0,0,0,0,0,0,0,0,0,1,-7,0,0,0,0,0,0,0,0,0,0,0,0,1,-7,0,0,0,0,0,0,0,0,0,0,0,0,1,-7,0,0,0,0,0,0,0,0,0,0,0,0,1,-7,0,0,0,0,0,0,0,0,0,0,0,0,1,-7,0,0,0,0,0,1,0,1,0,0,0,0,0,-7,-9,-9,-7,-9,-7,-9,-7,-9,-7,-7,-7,-9,-7,-9,-7,-9,-7,-9,-7,-9,-7,-9,-7,-9,-7,-9,-7,-9,-7,-9,-7,-9,-7,-9,-7,-7,-7,-7,-7,-9,-9,-9,-9,-9,-9,-9,-9,-9,-7,-9,-9,-9,-9,-9,-9,-9,-7,-9,-7,-7,-7,-9,-7,-7,-7,-9,-7,-7, ,-9,-9,-7,-7,-9,-7,-7,-7,-9,-7,-7,-7,-9,-7,-7,-7,-9, ,-7,-7,-7,-9,-9,-9,-9,-9,-9,-9,-9,-7,-9,-7,-913,2/4/11,WA,1,1,3,1,-7,1,16,16,2,Washington State Division of Vocational Rehabilitation (DVR),Department of Social and Health Services,DVR Director,DSHS Secretary,1,DSHS Secretary,-7,DSHS Chief of Staff,2,-7,-7,2,3,2,2,2,3,3,2,2,2,3,3,"Higher Education Coordinating Board, State Board of Community and Technical Colleges, Office of Supe",3,3,3,1,3,3,3,3,1,2,-7,317,-9,-7,-7,-9,-7,-7,-9,-7,-7,-9,-7,-7,-9,-7,-7,317,253.6,63.4,-9,-7,-7,-9,-9,-7,-9,-7,-7,-7,3,0,1,11,0,0,23,0,92,0,0,2,23,0,0,0,-9,-7,3,1,1,1,1,1,1,1,-7,1,1,1,1,1,1,-7,1,-7,1,1,1,1,1,-7,1,-7,1,0,0,0,0,0,-7,-7,-7,0,0,0,0,0,1,-7,-7,1,-7,1,Input from stakeholders and staff.,1,1,-7,1,-7,1,Baldridge,1,1,1,1,1,1,1,-7,0,0,1,0,1,1,1,1,1,1,0,0,0,-7,0,0,0,0,0,1,0,1,0,0,0,0,0,-7,0,0,0,0,0,1,1,0,0,1,0,0,0,-7,0,0,0,0,0,0,0,0,0,0,0,0,1,-7,0,0,0,0,0,0,0,0,0,0,0,0,1,-7,0,0,0,0,0,1,0,1,0,0,0,0,0,-7,0,0,0,0,0,1,1,0,0,1,0,0,0,-7,0,0,0,0,0,0,0,1,0,0,0,1,0,Blind VR program,0,0,0,0,0,0,0,0,0,0,0,0,1,-7,0,0,0,0,0,0,0,0,0,0,0,1,0,VR Blind program,203,2,-7,2,-7,2,-7,1,State Developmental Disability or Mental Health,2,-7,2,-7,1,$8.55 ,3,-7,1,201,1,2,2,-7,2,-7,2,-7,2,-7,3,-7,2,-7,2,-7,-7,-7,-7,-7,0,1,0,1,0,0,0,0,0,-7,0,0,1,1,0,0,0,-7,2,-7,-7,-7,2,-7,-7,-7,2,-7,-7, ,2,-9,-7,-7,2,-7,-7,-7,2,-7,-7,-7,2,-7,-7,-7,2, ,-7,-7,-7,1,0,0,0,1,1,0,0,-7,2,-7,SE extended services are funded by other entities. The DSU does not fund extended services. This DSU uses SE funds to provide general VR services to SE customers.126,3/9/11,WA,2,2,4,2,Assistant Director - Customer Services,3,3,5,1,Washington Department of Services for the Blind,-7,Executive Director,-7,1,-9,-7,Deputy Chief of Staff,2,-7,-7,3,3,3,3,3,3,3,3,3,3,3,-9,-7,3,3,1,3,3,3,1,3,1,1,The Tribal VR Program,75,-9,-7,-7,-9,-7,-7,4,-9,-9,-9,-7,-7,3,-9,-9,68,-9,-9,-9,-7,-7,-9,-9,-7,-9,-7,-7,-7,0,62,1,0,0,0,0,0,7,0,0,7,3,0,0,0,0,-9,3,1,1,1,1,1,1,1,-7,3,1,3,3,1,95,-9,95,-9,1,1,1,1,1,-7,1,-7,0,0,1,0,0,0,ARRA,-7,-7,0,0,0,0,1,0,-7,Charitable Giving,1,-7,1,Use of the State Plan process,1,1,-7,1,-7,2,-7,-7,1,1,1,1,1,1,-7,0,0,0,0,1,0,1,0,0,0,0,1,0,Tribal VR programs,0,0,0,0,0,0,0,0,0,0,0,0,1,-7,0,0,1,0,0,0,0,0,0,0,0,0,0,-7,0,0,0,0,0,0,0,0,0,0,0,0,1,-7,0,0,0,0,0,0,0,0,0,0,0,0,1,-7,0,0,0,0,0,0,0,0,0,0,0,1,0,Washington General and Tribal VR,0,0,0,0,0,0,1,0,0,0,0,0,0,-7,0,0,0,0,0,0,0,0,0,0,0,1,0,Washington General,0,0,0,0,0,0,0,0,0,0,0,0,1,-7,0,0,0,0,0,0,0,0,0,0,0,1,0,Washington General,7,2,-7,2,-7,2,-7,2,-7,-7,-7,2,-7,2,-7,3,-7,3,-7,3,-7,2,-7,3,-7,2,-7,3,-7,3,-7,3,-7,2,-7,-7,-7,-7,-7,1,1,1,1,0,0,1,0,0,-7,1,0,0,0,1,0,0,-7,2,-7,-7,-7,2,-7,-7,-7,2,-7,-7, ,2,-9,-7,-7,2,-7,-7,-7,2,-7,-7,-7,2,-7,-7,-7,2, ,-7,-7,-7,3,0,0,0,0,0,0,1,-7,2,-7,-988,2/16/11,WI,3,1,1,2,Deputy Administrator,0,8,8,2,Wisconsin Division of Vocational Rehabilitation,Department of Workforce Development,Division Administrator,Secretary,1,Secretary,-7,Secretary of Department of Workforce Development,2,-7,-7,3,3,3,3,3,3,2,3,3,3,2,-9,-7,3,3,3,1,2,99,1,3,3,1,Great Lakes Inter-tribal Council,311,-9,-7,-7,-9,-7,-7,0.18,-7,0.18,-9,-7,-7,2.44,-9,2.44,311,218,93,-9,-7,-7,-9,-9,-7,-9,-7,-7,-7,0,0.5,0,0.5,0,0,0,0,0,0,0,0,0,0,0,0,0,-9,3,1,1,1,1,1,1,2,-7,3,3,2,1,1,95,Department of Administration,1,-7,1,1,1,1,1,-7,1,-7,0,0,0,1,0,0,-7,Techworks,-7,0,1,1,0,0,0,-7,-7,1,-7,1,State Plan,1,1,-7,1,-7,1,In house-quality assurance review team,2,1,1,1,1,1,1,-7,1,0,1,1,1,1,1,1,1,1,1,0,0,-7,0,0,0,0,1,1,1,1,0,1,1,0,0,-7,0,0,0,1,0,0,1,0,0,1,0,0,0,-7,0,0,0,0,0,0,0,0,0,0,0,0,1,-7,0,0,0,0,0,0,0,0,0,0,0,0,1,-7,0,0,0,0,1,1,1,1,1,1,1,0,0,-7,0,0,0,0,1,1,1,1,0,1,0,0,0,-7,0,0,0,0,0,0,0,0,0,0,0,0,1,-7,0,0,0,0,0,0,0,0,0,0,0,0,1,-7,0,0,0,0,0,0,0,0,0,0,0,0,1,-7,217,-9,-7,-9,-7,-9,-7,1,long term support (MA waiver),-9,-7,2,-7,1,at least min. wage/competitive wage,1,-9,1,-9,1,-9,2,-7,2,-7,2,-7,1,-9,-9,-7,-9,-7,-9,-7,-7,-7,-7,-7,1,1,0,1,0,1,0,0,0,-7,1,0,1,1,1,0,0,-7,2,-7,-7,-7,2,-7,-7,-7,2,-7,-7, ,2,-9,-7,-7,2,-7,-7,-7,2,-7,-7,-7,2,-7,-7,-7,2, ,-7,-7,-7,-9,-9,-9,-9,-9,-9,-9,-9,-7,-9,-7,"For some of the questions, it requires special reports and we did not run those reports."