77,8/25/11,ID,1,1,2,1,-7,7.5,7.5,25,2,Idaho Division of Vocational Rehabilitation,The State Board of Education,Administrator,Executive Director of the State Board of Education,3,-7,-7,The Executive Director of the State Board of education,2,-7,-7,3,2,3,3,3,3,3,3,3,3,3,-9,-7,3,3,3,3,99,3,3,-9,1,1,There are four Tribal VR projects in the state each housed on the various Tribal reservations.,151,-9,-7,-7,-9,-7,-7,-9,-7,-7,-9,-7,-7,-9,-7,-7,147.5,-9,-9,-9,-7,-7,3,-9,-9,-9,-7,-7,-7,0,0,0,3.5,10,0,-9,11,48,0,0,0,12,0,0,0,-9,-7,3,2,1,1,1,1,1,1,-7,1,1,1,1,1,1,-7,1,-7,1,1,1,1,1,-7,95,"There are set rules in the state for fund expenditures and transfers. The DSU works with the State Controller's office, the Division of Financial Management, and the State Board of Education.",0,0,1,0,0,0,MSFW grant and the Quality training grant,-7,-7,1,1,1,1,0,0,third party grants,-7,1,-7,1,"We follow the regulations performing needs assessment, develop a plan and get approval from RSA. There is also an internal state parallel strateg",1,1,-7,1,-7,2,-7,-7,1,1,1,1,1,95,"The DSU has a primary role; however, the Department of Administration, Division of Purchasing has final say of contracts or purchase over $5000.",1,0,1,1,1,1,1,1,1,1,1,0,0,-7,0,0,0,0,0,0,0,0,0,0,0,1,0,CRPs,1,0,1,1,1,0,1,1,0,0,0,0,0,-7,1,0,1,0,1,0,0,1,0,0,0,1,0,"The State Independent Living Council, one IL center, and the Idaho Educational Bureau of Services for the Deaf and the Blind",1,0,1,0,1,0,0,1,0,0,0,0,0,-7,1,0,1,0,1,0,0,1,0,0,1,0,0,-7,1,0,1,0,1,0,1,1,0,0,1,1,0,IESDB educational services for the Deaf and the Blind and the Commission for the Blind and Visually Impaired.,0,0,0,0,0,0,0,0,0,0,0,0,1,-7,0,0,0,0,0,0,0,0,0,0,0,0,1,-7,0,0,0,0,0,0,0,0,0,0,0,0,1,-7,-9,2,-7,-9,-7,2,-7,1,Post employment services may be used on occasion.,2,-7,2,-7,2,-7,2,-7,1,-9,3,-7,3,-7,3,-7,2,-7,2,-7,3,-7,2,-7,1,The program currently is contracted out to a vendor and provides ongoing services to about 750 clients.,exclusively state general fuds,3490000,1000,"Primarily the DD and MH populations. It isn't restricted to other disabilities; however, few others",0,1,1,0,0,0,1,0,0,-7,1,0,1,0,0,0,0,-7,2,-7,-7,-7,2,-7,-7,-7,1,1,1,200,2,-9,-7,-7,2,-7,-7,-7,2,-7,-7,-7,2,-7,-7,-7,2, ,-7,-7,-7,2,0,0,0,0,0,0,1,-7,2,-7,-9164,4/1/11,ID,2,2,4,2,Rehabilitation Services Chief,4,4,15,1,Idaho Commission for the Blind and Visually Impaired,-7,Administrator,-7,3,-7,-7,Commission Board Chairperson,2,-7,-7,3,3,3,3,3,3,3,3,3,3,3,-9,-7,3,3,1,1,99,99,1,3,1,1,-7,39,-9,-7,-7,-9,-7,-7,8,-9,8,-9,-7,-7,2,2,-9,7,7,-9,-9,-7,-7,-9,-9,-7,22,-9,22,-9,-9,26.5,-9,-9,-9,-9,-9,-9,5,-9,-9,3,-9,-9,-9,-9,2,Assistive Tech,3,3,1,1,1,1,1,1,-7,1,1,1,1,1,1,-7,1,-7,1,1,1,1,1,-7,1,-7,0,0,0,0,0,1,-7,-7,-7,0,0,0,1,1,0,Social Security,Donations,1,-7,2,-7,1,1,-7,1,-7,2,-7,-7,1,1,1,1,1,1,-7,0,0,1,0,1,0,1,0,0,0,0,0,0,-7,0,0,0,0,0,0,0,0,0,0,0,0,1,-7,0,0,0,0,0,0,0,0,0,0,0,1,0,Commission on Aging,0,0,0,0,0,0,0,0,0,0,0,0,1,-7,0,0,0,0,0,0,0,0,0,0,0,0,1,-7,0,0,0,0,0,0,0,0,0,0,0,0,1,-7,0,0,0,0,0,0,1,0,0,0,0,0,0,-7,0,0,0,0,0,0,0,0,0,0,0,0,1,-7,0,0,0,0,0,0,0,0,0,0,0,0,1,-7,0,0,0,0,0,0,0,0,0,0,0,0,1,-7,0,2,-7,2,-7,2,-7,2,-7,-7,-7,2,-7,1,Federal minimum wage,2,-7,3,-7,3,-7,2,-7,2,-7,2,-7,2,-7,3,-7,2,-7,2,-7,-7,-7,-7,-7,0,1,1,0,0,0,0,0,0,-7,0,0,0,0,0,1,0,Medicaid waiver documentation or EES eligibility documentation,-9,-7,-7,-7,2,-7,-7,-7,1,1,2, ,2,-9,-7,-7,2,-7,-7,-7,2,-7,-7,-7,2,-7,-7,-7,1,Extended Employment Services - State General Fund only (limited),1,-9,-7,3,0,0,0,0,0,0,1,-7,-9,-7,-932,8/25/11,IL,3,1,2,2,Planning Administrator,17,21,21,2,Illinois Division of Rehabilitation Services,Department of Human Services,Director,Secretary,1,Governor,-7,Assistant Secretary,2,-7,-7,1,3,2,3,2,3,3,-9,2,2,3,1,Home Services Program,3,1,1,1,1,99,1,99,1,2,-7,1316,-9,-7,-7,516,-9,516,4,-9,4,-9,-7,-7,14,-9,14,526,526,-9,-9,-7,-7,1,-7,1,222,-9,222,Home Services Program,1,65,6,30,0,5,0,0,4,0,0,7,45,0,0,0,0,-9,1,1,1,2,1,2,1,2,-7,3,3,3,3,1,95,Dept. of Central Management Svcs,95,Dept. of Central Management Svcs,1,1,1,1,1,-7,1,-7,1,1,1,0,0,0,Migrant grant,-7,-7,0,0,0,1,0,0,Social Security reimbursement,-7,1,-7,2,-7,2,1,-7,1,-7,2,-7,-7,1,1,1,1,1,1,-7,0,0,1,1,0,0,0,1,0,0,1,0,0,-7,0,0,0,0,0,0,0,0,0,0,0,0,1,-7,0,0,0,0,0,0,1,0,0,1,0,0,0,-7,0,0,1,0,0,0,0,1,0,0,0,0,0,-7,0,0,0,0,0,0,0,0,0,0,1,0,0,-7,0,0,0,0,0,0,0,1,0,0,0,0,0,-7,0,0,0,0,1,0,1,0,0,0,0,0,0,-7,0,0,0,0,0,0,0,0,0,0,0,0,1,-7,0,0,0,0,0,0,0,0,0,0,0,0,1,-7,0,0,0,0,0,0,0,0,0,0,0,0,1,-7,390,1,90,1,10,2,-7,2,-7,-7,-7,2,-7,1,state minimum wage $8.50/hour,1,390,3,-7,2,-7,3,-7,3,-7,2,-7,2,-7,3,-7,2,-7,1,State funded extended services,State general revenue funds,985000,184,Primarily developmentally disabled,0,1,0,0,0,0,0,0,0,-7,0,1,0,0,0,0,0,-7,2,-7,-7,-7,2,-7,-7,-7,2,-7,-7, ,2,-9,-7,-7,2,-7,-7,-7,2,-7,-7,-7,2,-7,-7,-7,2, ,-7,-7,-7,2,0,0,0,0,0,0,1,-7,2,-7,DRS continues to make efforts to move individuals served in supported employment into natural supports.  Funding for extended services remains an ongoing issue in our state.   In the current fiscal environment it is unlikely that funding can be sustained at the present level.49,8/24/11,IN,3,1,5,2,Director of Policy and Planning,1.5,17.5,17.5,2,Indiana Bureau of Rehabilitation Services,Division of Disability and Rehabilitative Services,BRS Director,DDRS Director,1,DDRS Director,-7,DDRS Director,2,-7,-7,2,3,2,3,3,3,3,3,3,3,3,-9,-7,1,3,1,1,99,99,1,99,1,2,-7,326,-9,-7,-7,-9,-7,-7,1.25,1.25,-9,-9,-7,-7,5,5,-9,326,326,-9,-9,-7,-7,-9,-7,-7,-9,-7,-7,-7,0,20,3,23,0,0,0,0,0,0,0,0,0,0,0,0,-9,-7,3,1,1,3,1,1,1,1,-7,1,3,3,3,1,1,-7,1,-7,1,1,1,1,1,-7,1,-7,1,0,1,0,0,0,"HHS Traumatic Brain Injury, RSA Training Grant; MiG",-7,-7,0,0,0,1,0,0,SSA/VR Reimbursement,-7,1,-7,2,-7,1,1,-7,1,-7,2,-7,-7,1,1,1,1,3,1,-7,0,0,0,0,1,1,0,0,0,0,1,0,0,-7,0,0,0,0,0,1,0,0,0,0,0,0,0,-7,0,0,0,0,0,1,0,0,0,0,0,0,0,-7,0,0,0,0,0,0,0,0,0,0,0,0,1,-7,0,0,0,0,0,0,0,0,0,0,0,0,1,-7,0,0,0,0,0,0,0,0,0,0,0,0,1,-7,0,0,0,0,0,1,1,1,0,0,0,0,0,-7,0,0,0,0,0,1,0,1,0,0,0,0,0,-7,0,0,0,0,0,0,0,0,0,0,0,0,1,-7,0,0,0,0,0,0,0,0,0,0,0,1,0,Medicaid rates used when appropriate,887,2,-7,2,-7,2,-7,2,-7,-7,-7,2,-7,1,Minimum federal wage,2,-7,1,887,3,-7,3,-7,3,-7,2,-7,3,-7,3,-7,2,-7,2,-7,-7,-7,-7,-7,0,1,1,0,0,0,0,0,0,-7,0,0,0,1,0,1,0,Transfer to SEFA form sent from VR to DD Agency to facilitate the continuity of SE extended services,1,1,2,-7,2,-7,-7,-7,1,1,2, ,2,-9,-7,-7,1,1,2,-7,2,-7,-7,-7,2,-7,-7,-7,2, ,-7,-7,-7,2,0,0,0,0,0,0,1,-7,1,People with traumatic brain injuries,"VR does not monitor SE extended services, therefore much of the data is not available at this time."75,9/19/11,KY,1,1,1,1,-7,6.5,6.5,6.5,2,Kentucky Office of Vocational Rehabilitation,Kentucky Department for Workforce Investment,Ex. Director OVR,Commissioner of Workforce investment,1,Governor,-7,Commissioner,2,-7,-7,3,3,3,3,3,2,2,3,3,2,3,-9,-7,1,2,2,1,1,1,1,99,1,2,-7,390,-9,-7,-7,-9,-7,-7,-9,-7,-7,-9,-7,-7,-9,-7,-7,409,-9,-9,-9,-7,-7,-9,-9,-7,-9,-7,-7,-7,0,0,22,18,0,0,0,0,4.5,0,0,0,1,2,0,0,0,-9,2,1,1,1,1,1,1,1,-7,1,1,1,1,1,1,-7,1,-7,1,1,1,1,1,-7,1,-7,0,0,1,0,0,0,Migrant,-7,-7,1,0,0,0,0,0,-7,-7,1,-7,1,-9,1,1,-7,1,-7,2,-7,-7,1,1,1,1,1,1,-7,1,0,1,1,1,0,1,1,0,0,1,0,0,-7,0,0,0,0,0,0,0,1,0,0,0,0,0,-7,0,0,1,0,0,0,1,0,0,0,0,1,0,Office of employment and Training,0,0,1,0,1,0,0,0,0,0,0,0,0,-7,0,0,0,0,0,0,0,0,0,0,0,0,1,-7,0,0,0,0,0,0,0,0,0,0,0,1,0,Office of Employment and Training,0,0,0,0,0,0,0,0,0,0,0,0,1,-7,0,0,0,0,0,0,0,0,0,0,0,0,1,-7,0,0,0,0,0,0,0,0,0,0,0,0,1,-7,0,0,0,0,0,0,0,0,0,0,0,0,1,-7,250,2,-7,2,-7,2,-7,2,-7,-7,-7,2,-7,1,minimum wage,2,-7,1,-9,1,-9,2,-7,2,-7,2,-7,1,-9,1,-9,2,-7,2,-7,-7,-7,-7,-7,0,1,1,0,0,0,0,0,0,-7,1,0,0,0,1,0,0,-7,2,-7,-7,-7,2,-7,-7,-7,1,1,2, ,2,-9,-7,-7,2,-7,-7,-7,1,1,2,-7,2,-7,-7,-7,2, ,-7,-7,-7,2,0,1,0,0,1,0,0,-7,2,-7,-9118,8/25/11,KY,2,2,1,1,-7,2.5,2.5,2.5,2,Kentucky Office for the Blind,Kentucky Department for Workforce Investment,Executive Director,Commissioner,1,Governor,-7,Commissioner,2,-7,-7,3,3,3,3,3,3,2,3,3,3,3,3,-9,1,2,1,1,2,99,1,99,2,2,-7,103,6,6,-9,-9,-7,-7,10,10,-9,10,10,-9,11,-9,-9,71,71,-9,-9,-7,-7,-9,-7,-7,-9,-7,-7,-7,0,103,18,1,0,0,0,1,17,0,0,4,1,0,0,0,-9,-7,2,1,1,2,1,2,2,95,Education Cabinet - Division of Personnel,2,2,3,3,3,2,-7,95,Education Cabinet - DSA and above,1,1,1,1,1,-7,1,-7,0,0,1,0,1,0,Blind Basic Grant Award,-7,Federal - Blind Quality Award,0,0,0,0,0,1,-7,-7,1,-7,1,"SLOT Analysis, Utilized a Facilitator",1,1,-7,1,-7,2,-7,-7,1,1,1,1,1,95,Education Cabinet - Administration and Budget,0,0,1,1,1,0,0,0,0,0,0,1,0,Office of Vocational Rehabilitation,0,0,0,0,0,0,0,0,0,0,0,1,0,Office of Vocational Rehabilitation,0,0,0,0,0,0,1,0,0,0,0,1,0,"Area Development District, Office of Vocational Rehabilitation",0,0,1,0,0,0,0,0,0,0,0,0,0,-7,0,0,0,0,0,0,1,0,0,0,0,1,0,Office of Vocational Rehabilitation,0,0,0,0,0,0,0,0,0,0,0,1,0,Office of Vocational Rehabilitation - Deaf/Blind Services,0,0,1,1,0,0,1,0,0,0,0,0,0,-7,0,0,0,0,0,0,1,0,0,0,0,1,0,Office of Vocational Rehabilitation,0,0,0,0,0,0,0,0,0,0,0,1,0,Office of Vocational Rehabilitation,0,0,0,0,0,0,0,0,0,0,0,1,0,Office of Vocational Rehabilitation,-9,2,-7,2,-7,2,-7,2,-7,-7,-7,2,-7,1,Minimum Wage,2,-7,1,-9,1,0,2,-7,2,-7,2,-7,3,-7,3,-7,2,-7,2,-7,-7,-7,-7,-7,0,1,1,0,1,0,0,0,0,-7,1,0,0,0,0,0,0,-7,2,-7,-7,-7,2,-7,-7,-7,2,-7,-7, ,1,2,2,-7,2,-7,-7,-7,2,-7,-7,-7,2,-7,-7,-7,2, ,-7,-7,-7,2,0,1,0,0,1,0,0,-7,1,"Blind/Visually Impaired, Mental Illness, Severe Physical Disabilities",-980,8/25/11,LA,3,1,1,2,Interim Director,2,22,22,2,Louisiana Rehabilitation Services,Louisiana Workforce Commission,Rehabilitation Services Director,"Director, Office of Workforce Development",2,-7,-7,"Director, Office of Workforce Development",1,1,"Effective July 1, 2010, Louisiana Rehabilitation Services was moved from the Louisiana Department of Social Services to the Louisiana Workforce Commission.  The DSU was a separate 'Office' under the Department of Social Services and had the same organizat",3,3,3,3,3,3,2,3,3,3,3,-9,"The programs above are under the Louisiana Department of Education, Louisiana Department of Health a",99,3,1,1,1,1,1,99,1,1,"Louisiana has two Section 121 Projects, the United Houma Nation Vocational Rehabilitation Program and the Central Louisiana Intertribal Vocational Rehabilitation Program",325,-9,-7,-7,-9,-7,-7,1,1,-7,-9,-7,-7,10,10,-9,314,314,-9,-9,-7,-7,-9,-9,-7,-9,-7,-7,-7,0,8,8,8,0,0,-9,-9,0,0,0,0,8,14,0,0,0,-9,2,1,1,2,1,2,1,2,-7,2,1,3,1,1,2,-7,1,-7,1,1,1,2,1,-7,95,"Louisiana Workforce Commission, executive management",0,0,0,0,0,1,-7,-7,-7,0,0,1,0,0,0,-7,-7,1,-7,1,State agencies are required to engage in strategic planning every three to five years.  The state has established uniform goals for state governm,1,1,-7,1,-7,2,-7,-7,1,1,1,1,1,1,-7,0,0,0,1,1,1,1,1,1,0,1,0,0,-7,0,0,0,0,0,0,0,0,0,0,0,1,0,not sure which ones we have formal agreements with,0,0,0,0,0,0,1,0,0,0,0,0,0,-7,0,0,0,0,0,0,0,0,0,0,0,0,1,-7,0,0,0,0,0,0,0,0,0,0,0,0,1,-7,0,0,1,0,1,0,1,1,1,0,0,0,0,-7,0,0,0,1,0,0,1,0,0,0,0,0,0,-7,0,0,0,0,0,0,0,0,0,0,0,0,1,-7,0,0,0,0,0,0,0,0,0,0,0,0,1,-7,0,0,0,0,0,0,0,0,0,0,0,0,1,-7,-9,-9,-7,-9,-7,-9,-7,-9,-7,-7,-7,2,-7,1,minimum wage,2,-7,3,-7,3,-7,3,-7,3,-7,2,-7,3,-7,3,-7,2,-7,2,-7,-7,-7,-7,-7,1,1,1,0,1,0,0,0,0,-7,0,0,0,1,0,0,0,-7,1,-9,2,-7,2,-7,-7,-7,-9,-7,-7, ,-9,-9,-7,-7,-9,-7,-7,-7,-9,-7,-7,-7,2,-7,-7,-7,-9, ,-7,-7,-7,3,0,0,0,0,0,0,1,-7,2,-7,-9161,9/2/11,MA,1,1,4,2,Assistant Commissioner,3,8,8,1,Massachusetts Rehabilitation Commission,-7,Commissioner Charles Carr,-7,1,Governor,-7,Assistant Secretary of Health and Human Services,2,-7,-7,1,3,3,3,3,3,3,3,3,3,3,-9,-7,1,3,3,1,99,99,99,99,99,2,-7,352.43,-9,-7,-7,-9,-7,-7,-9,-7,-7,-9,-7,-7,-9,-7,-7,-9,-7,-7,-9,-7,-7,-9,-9,-7,-9,-7,-7,-7,6,0,24,13,0,0,0,0,0,0,0,0,6,0,0,0,0,-9,3,1,1,1,1,1,1,1,-7,3,1,1,1,1,95,-9,1,-7,1,1,1,1,1,-7,1,-7,0,0,0,0,1,0,-7,-7,-9,0,0,0,0,0,1,-7,-7,1,-7,1,MRC uses RSA State Planning Process,1,1,-7,1,-7,1,ongoing QA process,2,1,1,3,1,3,1,-7,0,0,0,1,1,1,1,1,0,0,0,0,0,-7,0,0,0,0,0,0,0,0,0,0,0,0,1,-7,0,0,0,0,0,0,0,0,0,0,0,0,1,-7,0,0,0,0,0,0,0,0,0,0,0,0,1,-7,0,0,0,0,0,0,0,0,0,0,0,0,1,-7,0,0,0,0,0,0,0,0,0,0,0,0,1,-7,0,0,0,0,0,0,0,0,0,0,0,0,1,-7,0,0,0,0,0,0,0,1,0,1,0,0,0,-7,0,0,0,0,0,0,0,1,0,1,0,0,0,-7,0,0,0,0,0,0,0,1,0,1,0,0,0,-7,214,2,-7,2,-7,1,100,1,"DDS, Clubhouses",2,-7,2,-7,1,Minimum wage,3,-7,1,214,3,-7,2,-7,2,-7,2,-7,2,-7,3,-7,2,-7,1,Ongoing support services,state funded,1320696.96,434,"TBI, Aspergers, MH, MR, LD",0,1,0,0,0,0,1,0,0,-7,1,1,0,0,0,0,0,-7,1,2,2,-7,2,-7,-7,-7,2,-7,-7, ,2,-9,-7,-7,2,-7,-7,-7,2,-7,-7,-7,2,-7,-7,-7,2, ,-7,-7,-7,3,0,0,0,0,0,0,1,-7,2,-7,-944,2/9/11,MA,2,2,4,2,Director Policy Development,8,28,38,1,Massachusetts Commission for the Blind,-7,Commissioner,-7,1,Secretary of Health and Human Services,-7,Assistant Secretary for Disability Policy and Programs,2,-7,-7,1,3,2,2,2,3,3,3,2,2,3,-9,-7,1,3,1,1,-9,-9,1,3,1,2,-7,110,-9,-7,-7,-9,-7,-7,-9,-7,-7,-9,-7,-7,3,3,-9,107,107,-9,-9,-7,-7,-9,-9,-7,-9,-7,-7,-7,-9,100,2,2,-9,-9,-9,-9,-9,-9,-9,6,-9,-9,-9,-9,-9,-7,1,3,1,1,1,1,1,1,-7,2,1,1,2,1,1,-7,1,-7,1,1,1,1,2,-7,1,-7,0,0,0,0,0,1,-7,-7,-7,0,0,0,1,0,0,Commonwealth of Massachusetts,-7,1,-7,1,Currently developing process and plan for the next five years.,1,1,-7,1,-7,2,-7,-7,1,1,3,1,3,1,-7,0,0,1,1,1,1,1,1,1,1,1,0,0,-7,0,0,1,1,1,1,1,1,1,1,1,0,0,-7,0,0,0,0,0,0,0,0,0,0,0,0,1,-7,0,0,0,0,0,0,0,0,0,0,0,0,1,-7,0,0,0,0,0,0,0,0,0,0,0,0,1,-7,0,0,1,1,1,0,1,0,0,0,0,0,0,-7,0,0,0,0,0,0,0,0,0,0,0,0,1,-7,1,0,0,1,0,1,1,1,1,1,0,0,0,-7,0,0,0,0,0,0,0,0,0,0,0,0,1,-7,1,0,0,1,0,1,1,1,1,1,0,0,0,-7,5,2,-7,2,-7,2,-7,-9,-7,-7,-7,2,-7,1,Massachusetts minimum wage,2,-7,3,-7,3,-7,3,-7,3,-7,2,-7,2,-7,3,-7,2,-7,2,-7,-7,-7,-7,-7,1,1,0,0,1,0,0,0,0,-7,0,0,0,1,0,0,0,-7,-9,-7,-7,-7,-9,-7,-7,-7,2,1,-7, ,2,-9,-7,-7,-9,-7,-7,-7,-9,-7,-7,-7,-9,-7,-7,-7,1,state funds for the agency's DEAF-BLIND MULTICHANDICAPPED Program,1,2,-7,2,0,0,0,0,0,0,1,-7,1,a number of blind consumers with multiple very and significant disabilities,-9123,3/10/11,MD,3,1,2,1,-7,1,37,37,1,Maryland Division of Rehabilitation Services,-7,Assistant State Superintendent in Rehabilitation,-7,1,State Board of Education,-7,Deputy State Superintendent for Schools,2,-7,-7,1,3,3,3,3,3,3,3,3,3,3,-9,-7,99,1,1,1,99,99,1,99,99,2,-7,659.5,-9,-7,-7,247.5,-9,247.5,1,1,-7,-9,-7,-7,8,8,-9,237.5,237.5,-9,-9,-7,-7,-9,-7,-7,-9,-7,-7,-7,2,47,3,16,0,0,0,23,0,0,2,1,23,10,0,0,0,-9,3,1,1,1,1,1,1,1,-7,1,1,1,1,1,95,-9,1,-7,1,1,1,1,1,-7,1,-7,0,0,1,0,0,0,Seamless Transition Initiative,-7,-7,0,0,0,1,0,0,Social Security Reimbursement,-7,1,-7,1,Semi-annual agency planning meetings,1,1,-7,1,-7,2,-7,-7,1,1,1,1,1,1,-7,0,0,1,1,1,0,1,1,0,0,0,0,0,-7,0,0,0,0,0,1,0,1,0,0,0,0,0,-7,0,0,1,1,0,0,0,0,0,0,0,0,0,-7,0,0,1,1,1,0,0,0,0,0,0,0,0,-7,0,0,0,0,0,0,0,0,0,0,0,0,1,-7,0,0,1,1,1,1,0,1,0,0,0,0,0,-7,0,0,1,0,1,0,0,1,0,0,0,0,0,-7,0,0,0,0,0,0,0,0,0,0,0,0,1,-7,0,0,0,0,0,0,0,0,0,0,0,0,1,-7,0,0,0,0,0,0,0,0,0,0,0,0,1,-7,561,2,-7,2,-7,2,-7,-9,-7,-7,-7,2,-7,2,-7,1,561,3,-7,3,-7,3,-7,3,-7,2,-7,3,-7,3,-7,2,-7,2,-7,-7,-7,-7,-7,0,1,0,0,0,0,0,0,0,-7,0,0,0,0,0,0,1,-7,2,-7,-7,-7,2,-7,-7,-7,2,-7,-7, ,2,-9,-7,-7,2,-7,-7,-7,2,-7,-7,-7,2,-7,-7,-7,2, ,-7,-7,-7,2,0,0,0,0,0,0,1,-7,2,-7,-928,9/19/11,ME,1,1,1,1,-7,1,12,12,2,Maine Division of Vocational Rehabilitation,Department of Labor,"Director, Division of Vocational Rehabilitation","Commissioner, Department of Labor",2,-7,-7,"Director, Bureau of Rehabilitation Services",2,-7,-7,3,3,3,3,3,3,2,3,3,3,3,-9,-7,3,3,1,3,3,3,1,99,1,1,Houlton Band of Maliseet Indians,109,-9,-7,-7,-9,-7,-7,-9,-7,-7,-9,-7,-7,-9,-7,-7,109,98.1,10.9,-9,-7,-7,-9,-9,-7,-9,-7,-7,-7,0,0,0,5,0,0,0,0,7,0,0,0,20,0,0,0,-9,-7,1,1,1,1,1,1,1,1,-7,2,1,1,2,1,1,-7,1,-7,1,1,1,1,1,-7,1,-7,0,0,1,0,1,0,ARRA,-7,ISTG- Basic and Quality Award,0,0,1,0,0,0,-7,-7,1,-7,1,Project Management Planning Process,1,1,-7,1,-7,1,"Using a combination of Lean, and Value Stream Mapping, and our own project management process, we examined our entire VR process, made business p",1,1,1,1,1,1,1,-7,1,0,0,1,0,1,1,1,1,0,1,0,0,-7,0,0,0,0,0,1,0,1,0,0,0,0,0,-7,0,0,0,1,0,0,1,0,0,0,1,0,0,-7,0,0,0,0,0,1,1,1,0,0,0,0,0,-7,0,0,0,0,0,0,0,0,0,0,1,0,0,-7,0,0,1,1,0,1,1,1,1,0,0,0,0,-7,0,0,1,1,0,1,0,1,0,0,1,0,0,-7,0,0,0,0,0,1,0,1,0,0,0,0,0,-7,0,0,0,0,0,1,0,1,0,0,0,0,0,-7,0,0,0,0,0,1,0,1,0,0,0,0,0,-7,170,2,-7,2,-7,2,-7,2,-7,-7,-7,2,-7,1,7.5/hour,3,-7,3,-7,3,-7,3,-7,3,-7,2,-7,3,-7,3,-7,2,-7,2,-7,-7,-7,-7,-7,1,1,1,0,0,1,1,0,0,-7,1,1,1,0,0,0,0,-7,1,1,1,0,1,1,2,-7,1,1,2, ,1,1,2,-7,2,-7,-7,-7,1,1,2,-7,2,-7,-7,-7,2, ,-7,-7,-7,3,0,1,0,1,1,0,0,-7,1,Those not eligible for Dev Services who require extended support more than 5 hours a month.,-9163,8/25/11,ME,2,2,1,1,-7,3.5,8,18,2,Maine Division for the Blind and Visually Impaired (DBVI),Department of Labor,"Director, DBVI","Commissioner, DOL",2,-7,-7,"Bureau Director, Rehabilitation Services",2,-7,-7,3,-9,3,3,3,3,2,3,3,3,3,-9,-7,3,1,1,3,2,-9,1,-9,1,1,Wabanaki of Vocational Rehabilitation,36.5,-9,-7,-7,-9,-7,-7,-9,-7,-7,-9,-7,-7,3,1,2,34.5,24.5,9,-9,-7,-7,-9,-9,-7,-9,-7,-7,-7,0,36.5,0,0,0,0,0,0,5,0,0,10,3,0,0,0,-9,-7,2,2,1,1,1,1,1,95,Human resources,2,2,2,1,1,2,-7,1,-7,1,1,1,1,1,-7,1,-7,0,0,0,0,0,1,-7,-7,-7,0,0,0,1,0,0,Grant from Dept. of Education,-7,1,-7,2,-7,2,1,-7,1,-7,1,Maine State Government - Office of Program Evaluation and Government Accountability,1,1,1,1,1,1,1,-7,0,0,0,1,0,0,1,0,0,0,0,0,0,-7,0,0,0,1,0,0,1,0,0,0,0,0,0,-7,0,0,0,1,0,0,1,0,0,0,0,0,0,-7,1,0,0,0,1,1,0,1,1,0,1,0,0,-7,0,0,0,0,0,0,0,0,0,0,1,0,0,-7,0,0,0,0,0,1,0,1,1,0,1,0,0,-7,1,0,1,1,1,1,1,1,1,0,1,0,0,-7,0,0,0,0,0,1,0,1,0,0,0,0,0,-7,0,0,0,0,0,0,0,0,0,0,0,0,1,-7,0,0,0,0,0,0,0,0,0,0,0,0,1,-7,10,2,-7,2,-7,2,-7,-9,-7,-7,-7,2,-7,1,Successful closures must still make the current minumum wage per hour,-9,-7,-9,-7,-9,-7,-9,-7,-9,-7,-9,-7,-9,-7,-9,-7,-9,-7,1,"LTS, Brain Injury",State General Funds,63000,3,All and brain injury,1,1,1,0,0,1,1,0,0,-7,1,1,0,0,0,0,0,-7,2,-7,-7,-7,2,-7,-7,-7,1,1,2, ,1,1,2,-7,2,-7,-7,-7,2,-7,-7,-7,2,-7,-7,-7,2, ,-7,-7,-7,2,0,0,0,1,1,0,0,-7,1,Deaf-Blind,-945,3/14/11,MI,1,1,1,1,-7,8,35,35,2,Michigan Rehabilitation Services,"Department of Energy, Labor, & Economic Growth",Bureau Director,Department Director,2,-7,-7,Deputy DSA Director,2,-7,-7,3,3,3,3,3,3,2,3,3,3,2,-9,-7,3,3,2,1,2,1,2,3,1,1,Hannahville Indian Tribe,555,-9,-7,-7,-9,-7,-7,-9,-7,-7,-9,-7,-7,-9,-7,-7,555,549.5,5.55,-9,-7,-7,-9,-7,-7,-9,-7,-7,-7,0,0,31,17.5,0,0,0,25,0,0,5,0,62,2,0,6,-9,-7,2,1,1,1,1,1,1,1,-7,2,1,2,1,1,2,-7,1,-7,1,1,1,1,1,-7,1,-7,0,0,1,0,0,0,Assistive Technology Grant,-7,-7,0,1,1,1,0,0,SSA,-7,1,-7,1,Use detailed planning process with the State Rehabilitation Council,1,1,-7,1,-7,2,-7,-7,1,1,1,1,1,2,-7,1,0,1,1,1,1,1,1,1,1,1,0,0,-7,0,0,0,0,0,0,0,1,0,0,0,0,0,-7,0,0,1,1,1,0,0,1,0,1,0,1,0,"CRO, DHY, Social Security Office, City Building",0,0,1,1,1,0,1,1,1,0,0,0,0,-7,0,0,0,0,0,0,0,0,0,0,0,0,1,-7,1,0,1,1,1,0,1,1,1,1,0,0,0,-7,0,0,0,0,0,0,0,1,0,1,0,0,0,-7,0,0,0,0,0,0,0,0,0,0,0,0,1,-7,0,0,0,0,0,0,0,0,0,0,0,0,1,-7,0,0,0,0,0,0,0,0,0,0,0,0,1,-7,712,2,-7,2,-7,2,-7,2,-7,-7,-7,2,-7,2,-7,1,6,1,363,1,9,2,-7,2,-7,2,-7,2,-7,-9,-7,-9,-7,2,-7,-7,-7,-7,-7,0,0,0,1,0,0,0,0,0,-7,1,0,1,0,0,0,0,-7,2,-7,-7,-7,2,-7,-7,-7,-9,-7,-7, ,-9,-9,-7,-7,-9,-7,-7,-7,-9,-7,-7,-7,-9,-7,-7,-7,-9, ,-7,-7,-7,2,0,1,0,0,1,0,0,-7,1,Mental illness & cognitive impairment not served by local Mental Health agencies,-9128,9/6/11,MI,2,2,4,2,MCB Director of Consumer Services,8,38,38,1,Michigan Commission for the Blind,-7,MCB State Director,-7,2,-7,-7,"Deputy Director, Michigan Department of Energy, Labor & Economic Growth",2,-7,-7,3,3,3,3,3,3,3,3,3,3,3,1,-9,3,3,1,3,3,3,1,3,1,1,Hannahville Indian Community,111,-9,-7,-7,-9,-7,-7,2,-9,2,13,13,-9,8,8,-9,38,38,-9,-9,-7,-7,-9,-9,-7,111,-9,-9,blind rehabilitation services including VR,0,111,3,2,0,0,0,0,0,0,0,4,0,0,0,0,111,blind rehabilitation services including VR,3,1,1,1,1,1,1,1,-7,1,3,1,3,1,95,-9,95,-9,1,1,1,1,1,-7,1,-7,0,0,1,1,0,0,"ARRA, VR Title 1, IL Part B",state GFGP,-7,0,1,0,1,1,0,cash match,gift fund (donations),1,-7,1,a structured strategic planning process by teams open to staff and stakeholders,1,1,-7,1,-7,1,Baldrige,2,1,1,1,1,1,95,-9,1,0,1,1,1,0,1,1,1,0,1,1,0,Michigan Rehabilitation Services,0,0,0,0,0,0,0,1,0,0,0,0,0,-7,0,0,0,0,0,0,0,0,0,0,0,0,1,-7,0,0,1,0,1,0,0,0,0,0,0,0,0,-7,0,0,0,0,0,0,0,0,0,0,0,0,1,-7,0,0,1,0,1,0,0,0,0,0,0,0,0,-7,0,0,1,0,1,0,0,1,1,0,0,0,0,-7,0,0,0,0,0,0,0,0,0,0,0,0,1,-7,0,0,0,0,0,0,0,0,0,0,0,1,0,Michigan Rehabilitation Services,0,0,0,0,0,0,0,0,0,0,0,0,1,-7,16,1,80,1,20,1,0,1,Medicaid or Medicare,2,-7,2,-7,1,minimum wage or greater,3,-7,3,-7,3,-7,2,-7,2,-7,2,-7,2,-7,3,-7,3,-7,2,-7,-7,-7,-7,-7,1,1,1,1,1,1,0,0,0,-7,1,0,1,0,0,0,0,-7,2,-7,-7,-7,2,-7,-7,-7,2,-7,-7, ,1,1,2,-7,1,1,2,-7,2,-7,-7,-7,2,-7,-7,-7,2, ,-7,-7,-7,2,0,0,0,0,1,0,0,-7,2,-7,-9115,8/25/11,MN,1,1,1,1,-7,5,5,5,2,Minnesota Vocational Rehabilitation Services,Department of Employment and Economic Development,Director,Commissioner,2,-7,-7,Director of Workforce Development Division,2,-7,-7,2,3,3,3,3,3,2,3,3,3,3,-9,"Multiple agencies including Human Services, Education, Labor and Industry, Administration, etc.",3,3,2,1,2,99,2,99,1,1,Red Lake Nation; White Earth Nation,390,-9,-7,-7,-9,-7,-7,2,-9,2,3,0.05,2.5,-9,-7,-7,385,385,-9,-9,-7,-7,-9,-9,-7,-9,-7,-7,-7,0,0,35,10,0,0,0,10,75,0,0,0,25,0,0,0,-9,-7,1,2,1,1,1,1,1,1,-7,2,2,2,2,1,2,-7,2,-7,1,1,1,1,1,-7,1,-7,1,1,1,1,0,0,DOL Navigator Grant,Supported Employment Grants; State IL Grants,-7,0,0,0,0,0,1,-7,-7,1,-7,1,Strategic Leadership Team plus Council Chairs involved in development of strategic goals and priorities based on CNA,1,1,-7,1,-7,1,Six Sigma (Lean) Process improvement,1,1,1,1,1,1,1,-7,0,0,1,1,1,0,1,1,1,0,1,0,0,-7,0,0,0,0,0,0,0,1,0,0,0,0,0,-7,0,0,1,1,0,0,1,0,0,1,0,0,0,-7,0,0,1,1,0,1,1,1,0,0,1,0,0,-7,0,0,1,0,0,0,1,0,0,0,0,0,0,-7,0,0,1,1,1,0,1,0,0,0,0,0,0,-7,0,0,0,0,1,1,1,1,0,0,0,0,0,-7,0,0,0,0,0,0,0,0,0,0,0,0,1,-7,0,0,0,0,0,0,0,0,0,0,0,0,1,-7,0,0,0,0,0,0,0,0,0,0,0,0,1,-7,384,2,-7,2,-7,2,-7,2,-7,-7,-7,2,-7,2,-7,3,-7,3,-7,3,-7,3,-7,3,-7,2,-7,2,-7,3,-7,2,-7,1,Extended Employment Program,State General and Workforce Development funds,10500000,4056,"All disabilities, persons with 3 or more functional limitations",0,1,0,0,0,0,0,0,0,-7,1,0,0,0,0,0,0,-7,2,-7,-7,-7,2,-7,-7,-7,1,1,2, ,2,-9,-7,-7,2,-7,-7,-7,2,-7,-7,-7,2,-7,-7,-7,2, ,-7,-7,-7,3,0,0,0,0,0,0,1,-7,2,-7,-956,8/25/11,MN,2,2,1,1,-7,1,28,28,2,Minnesota State Services for the Blind,Department of Employment and Economic Security,Director,Commissioner,2,-7,-7,"Director, Workforce Development Division",2,-7,-7,2,3,3,3,3,3,2,3,3,3,3,-9,-7,3,3,1,2,99,99,1,99,1,1,Red Lake Nation and White Earth Tribal Council,64,-9,-7,-7,-9,-7,-7,-9,-7,-7,1,-7,-7,8,8,2,56,56,-9,-9,-7,-7,-9,-7,-7,-9,-7,-7,-7,0,64,-9,0,0,0,0,0,0,0,0,0,0,0,0,0,-9,-7,1,1,1,1,1,1,1,1,-7,1,1,1,2,1,1,-7,2,-7,1,1,1,1,1,-7,1,-7,0,0,0,0,0,1,-7,-7,-7,0,0,0,1,0,0,SSA reinbursement,-7,1,-7,1,Process in play as organization develops mission/vision and goals for 3-5 year period and annual unit work plans with metrics aligned with overal,2,1,-7,1,-7,2,-7,-7,1,1,1,-9,1,1,-7,0,0,0,1,1,0,0,0,0,0,0,0,0,-7,0,0,0,0,0,0,0,0,0,0,0,0,1,-7,0,0,0,1,0,0,1,0,0,0,0,1,0,co-located in local Workforce Centers,0,0,0,0,0,0,0,0,0,0,0,0,1,-7,0,0,0,0,0,0,0,0,0,0,0,0,1,-7,0,0,0,0,0,0,0,0,0,0,0,0,1,-7,0,0,0,0,0,0,0,0,0,0,0,0,1,-7,0,0,0,0,0,0,0,0,0,0,0,1,0,the general DSU in the state,0,0,0,0,0,0,0,0,0,0,0,0,1,-7,0,0,0,0,0,0,0,0,0,0,0,1,0,"In some instances, the General DSU",6,2,-7,2,-7,2,-7,1,Whatever type of extended services needed.,2,-7,2,-7,1,at least minumum wage,3,-7,3,-7,3,-7,2,-7,3,-7,2,-7,2,-7,3,-7,2,-7,2,-7,-7,-7,-7,-7,0,1,0,1,1,0,0,0,0,-7,1,0,0,1,0,0,0,-7,2,-7,-7,-7,1,1,2,-7,1,1,2, ,2,-9,-7,-7,2,-7,-7,-7,1,1,2,-7,2,-7,-7,-7,2, ,-7,-7,-7,1,0,0,0,0,0,0,1,-7,2,-7,Extended services to meet customers needs are difficult to secure on a systematic basis.141,4/1/11,MO,1,1,2,1,-7,7,22,22,2,Missouri Division of Vocational Rehabilitation,Department of Elementary & Secondary Education,Assistant Commissioner,Commissioner,1,State Board of Education,-7,Commisioner,1,1,"Division of VR (VR, DDS & IL) consolidated with Adult Learning Programs (GED, AEL, Veterans Ed & Employment Training). All Dept",1,3,3,3,3,2,3,3,3,3,3,1,"Office of Adult Learning& Rehabilitation Services is comprised of VR, DDS, IL, AEL, GED, Veterans Ed, Employment & Training",2,3,3,1,99,3,3,-9,1,2,-7,294.7,-9,-7,-7,372,-9,372,3,-9,3,-9,-9,-7,-9,-9,-7,294.7,294.7,-9,-9,-9,-7,-9,-7,-7,20,-9,20,"AEL, GED, Veterans Ed, Employment & Training",0,0,0,8,0,0,0,15,0,0,0,0,25,0,0,0,-9,-7,-9,1,1,1,-9,-9,-9,-9,-7,1,3,1,3,1,95,Office of Administration,95,Office of Administration,1,1,1,1,1,-7,1,-7,0,0,1,0,1,0,RSA In-Servoce Training Grant,-7,Dartmouth Evidence-Based Practices for MI,0,0,1,1,0,0,SSA Reimbursement,-7,1,-7,1,Comprehensive Assessment of Need and the State Plan,1,1,-7,1,-7,2,-7,-7,1,1,1,1,1,1,-7,-9,-9,-9,-9,-9,-9,-9,-9,-9,-9,-9,-9,-9,-7,-9,-9,-9,-9,-9,-9,-9,-9,-9,-9,-9,-9,-9,-7,-9,-9,-9,-9,-9,-9,-9,-9,-9,-9,-9,-9,-9,-7,0,0,0,0,0,0,0,0,0,0,0,0,1,-7,0,0,0,0,0,0,0,0,0,0,0,0,1,-7,0,0,0,0,0,0,0,1,0,0,0,1,0,Higher Education,-9,-9,-9,-9,-9,-9,-9,-9,-9,-9,-9,-9,-9,-7,-9,-9,-9,-9,-9,-9,-9,-9,-9,-9,-9,-9,-9,-7,0,0,0,0,0,0,0,0,0,0,0,0,1,-7,0,0,0,0,0,0,0,0,0,0,0,0,1,-7,695,2,-7,2,-7,2,-7,2,-7,-7,-7,2,-7,1,Minimum wage,2,-7,1,695,3,-7,2,-7,2,-7,2,-7,2,-7,2,-7,2,-7,2,-7,-7,-7,-7,-7,0,1,0,0,0,0,0,1,0,Senate,-9,-9,-9,-9,-9,-9,-9,-9,2,-7,-7,-7,2,-7,-7,-7,2,-7,-7,-7,2,-7,-7,-7,2,-7,-7,-7,2,-7,-7,-7,2,-7,-7,-7,2,-7,-7,-7,-7,2,0,0,0,0,0,0,1,-7,1,Populations not served by MH or DD agency,-9